date_utc,url,comments,matched_keyword,cleaned_title,cleaned_text,overall_sentiment_score_post,overall_sentiment_post
2023-11-16,https://www.reddit.com/r/TeslaModel3/comments/17w9li9/unfortunate_issue_after_last_update/,10,"Plug in Hybrid Electric Vehicle,Hybrid Electric Vehicle",unfortunate issue update,updated 2020 model 3 night software drive 2pm myriad electrical issues car drive wait power voltage system powers drive lot technical car shut feature due battery guess understand happened night drew power 12v battery 2020 bought month battery life update caused terminate mobile service earliest monday 20th called local service center bring car won drive stranded 3 days thurs fri sat hope rectify happened kicker nights update windows low 12v feature idk raining diagnose car automatically rolled window door worse roll fashion jump wife car enable car jumpers attached rolled solution window hit roll window function car quickly retract hand fine looked windows real life fluke expect,-0.9987416863441467,NEGATIVE
2022-11-08,https://www.reddit.com/r/TeslaModel3/comments/yq246a/better_than_waiting_in_line_at_the_gas_station/,11,gas,waiting line gas station,NA,-0.9944764971733093,NEGATIVE
2023-03-06,https://www.reddit.com/r/TeslaModel3/comments/11k0uyp/charging_question_why_do_my_since_last_charge/,11,Battery Electric Vehicle,charging question charge stats reset charge l2 charger manually reset charge stats,NA,-0.9859441518783569,NEGATIVE
2021-12-12,https://www.reddit.com/r/TeslaModel3/comments/retemk/dilemma/,11,fuel,dilemma,lr m3 grey 11 11 dubai tesla showroom edd placing feb 2022 fine waiting feb time sell car sort finances received offer current car add fuel fire low driven 2020 m3 performance sale price current contemplating ditch lr slightly performance guys recommend wait m3 lr feb slightly 2020 performance,-0.9985405206680298,NEGATIVE
2023-03-11,https://www.reddit.com/r/TeslaModel3/comments/11ow5li/going_to_look_at_a_used_2021_model_3_standard/,11,Hybrid Electric Vehicle,2021 model 3 standard range check,2021 model 3 standard range 26k miles 33k im dealership negotiate 31k hope check buying electric vehicle timer lol,-0.9909487366676331,NEGATIVE
2022-12-29,https://www.reddit.com/r/TeslaModel3/comments/zyirfz/good_to_have_options_especially_if_its_free_ccs1/,11,"Battery Electric Vehicle,Hybrid Electric Vehicle",options free ccs1 2018 model 3,NA,0.8280633687973022,POSITIVE
2024-05-03,https://www.reddit.com/r/TeslaModel3/comments/1cjm9bp/gulp/,11,"Plug in Hybrid Electric Vehicle,Hybrid Electric Vehicle",gulp,happened 95k miles sudden errors messages flashed unable drive sitting daughter's school parking lot waiting tow happened safe sitting car wait tow note funny observed battery 50 53,-0.9956039190292358,NEGATIVE
2023-06-01,https://www.reddit.com/r/TeslaModel3/comments/13x34r9/has_anyone_received_this_bs_before_i_just_reached/,11,fuel,received bs reached fundingresolution tesla.com summarized response fault pay ny pretty 2022 tesla model 3 awd eligible 500 paperwork issue tesla's,NA,-0.9928233623504639,NEGATIVE
2018-12-19,https://www.reddit.com/r/TeslaModel3/comments/a7jyt4/help_with_overpayment_on_my_m3/,11,"Plug in Hybrid Electric Vehicle,Hybrid Electric Vehicle",overpayment m3,"remaining balance due amount 4,421.50 purchase m3 earlier month inside delivery advisor sales adviser dealt provided assistance resolving matter documentation provided owed refund representative knowledgeable care inability speak knowledgeable tesla representative extremely frustrating communication transpire email indecisive replies distinct dichotomy car support received backend purchase hand m3 beautiful electric vehicle loaded tremendous amount technology auto driven hand customer support extremely disappointing top google search results tesla complaints revolve inability speak directly phone care attitude pervasive organization hope spend 65,000 car regret road desperately reimbursement 4,412.50 owed moment extremely frustrating acceptance tesla due overpayment amount experience dealing purchase hesitation recommending friend family purchasing tesla vehicle read post tesla account submit support ticket escalated executive level receive response experienced issue provide advise resolved advise appreciated",-0.9972483515739441,NEGATIVE
2019-04-09,https://www.reddit.com/r/TeslaModel3/comments/bb25kc/help_stuck_between_my_first_tesla_choice/,11,environment,stuck tesla choice,recommend decision guide 2019 model 3 standard cpo 2014 model 85 autopilot price comparable factor incentives m3 interior slightly wondering factor upside hardware m3 elon car sharing program future range comparable cpo program offers mechanical 75 check reliable pretty decent decisions vacillating chidi advance edit context ev 80mi round trip commute living ca hoping save gas ll carseat space nice live city suited urban environments,-0.995449960231781,NEGATIVE
2019-03-31,https://www.reddit.com/r/TeslaModel3/comments/b7ntl9/model_3_wont_supercharge_fixed_on_the_spot_by/,11,Battery Electric Vehicle,model 3 supercharge fixed spot mobile service hard reboot,amp x200b 1 model 3 friday afternoon yey 2 supercharger sake charged 80 battery 3 hit road experience drive amazing 4 home connected wall charger installed days ago receiving m3 5 charging started 6 30 minutes lights notification phone charging interrupted 7 deal minutes electricity charge resumed 8 day drove supercharger car hit 100 battery day's trip 9 car supercharge wtf stations luck 10 reset car wheel buttons break pedal wtf 11 home connected wall charger car charging wtf 12 drove supercharger car charging stations triple wtf amp x200b decided call customer service 10 15 minutes mobile service arrived verified yeah supercharging reset car wait minutes luck frunk hard reboot reset car guess tesla service car rebooted normal car supercharging drive car calling customer service hard reboot fix change leave car,-0.9970346689224243,NEGATIVE
2024-02-10,https://www.reddit.com/r/TeslaModel3/comments/1an80z3/one_year_and_32k_miles/,11,fuel,32k miles,"loved owning car ago purchased 2023 rwd deep blue metallic white interior 18 aero fsd eap range takes hit 80mph freeway freezing temps worse supercharger network makes roadtripping easy ice vehicle battery degradation minimal miles supercharging home charge 100 25 soc estimated range accurate ve arrived superchargers 1 times aim arrive 10 preferably 5 ve peak charge rate 176kw 10 didn tessie lifetime consumption sits 285wh mi issue ve fixed passenger window wasn sealing properly causing excessive wind noise 65mph mobile serviced fixed free charge replace rear tires 25,000 miles fault tire rotations resist instant torque speed service keeping car time imagine ll 32k miles guess ll",-0.9958930015563965,NEGATIVE
2022-12-31,https://www.reddit.com/r/TeslaModel3/comments/zzisdq/prepurchase_questions_are_all_2018_m3_lr_awd/,11,autonomous,prepurchase questions 2018 m3 lr awd,"recently found 2018 model 3 range 40,000 mi dealership advertising 35k premium package installed heated seats software upgrades autonomous driving cosmetically car condition inside 2018 model 3 range wheel drive vehicles driving features add purchasing deal rumor teslas affordable months car market starts stabilize idea wait ahead jump deal",-0.9715726971626282,NEGATIVE
2021-09-21,https://www.reddit.com/r/TeslaModel3/comments/psusg8/scored_my_tm3_sr_on_deep_blue_metallic_in_5_days/,11,Plug in Hybrid Electric Vehicle,scored tm3 sr deep blue metallic 5 days suggestions,redditverse sr fsd favorite tesla service advisor secure delivery 12 hrs placing online 2021 lpf battery models finish processing financial documents 5 days risk losing booking 1.24 apr dcu hack reddit commute 120 weeks desperate efficient vehicle tm3 brainer world ev wondering answer questions car lpf battery assume charge 100 time home official documentation online tweet https twitter.com elonmusk status 1431040308943364097 ref_src twsrc 5etfw 7ctwcamp 5etweetembed 7ctwterm 5e1431040308943364097 7ctwgr 5e 7ctwcon 5es1_ amp ref_url https 3a 2f 2fwww.teslarati.com 2ftesla model 3 lfp battery explains elon musk 2f elon sort charge 100 time extra careful tweet https twitter.com elonmusk status 1118225459416682496 lang en elon charge 90 95 advantage regen recommendation lpf pack link official tesla website charging 10 30 nema adapter hooked dryer port recently purchased tesla shop conveniently dryer car garage condo guys recommend 14 50 nema travel extension chord recommendation 240v port sorts chord recommendations online sort adapters plugs converters tm3 user carry trunk frunk prevent vampire charge drain home 3 5 battery charge drain overnight 1 set sentry mode home 2 wifi home 3 cabin overheat protection absolute set floor mats tm3 recommend tesla store 3rd party glass tinting recommendation tins type layers void tesla warranty means ev incentives southern california edison customer recommend switching toud toud prime plan toud plan recommend 7000 green deal credit retroactive 2021 cars solid information bill online gut feeling pass chance credit applied tax filing delay car commute ev incentive recommend ca residents 1500 clean air rebate purchase muchas gracias advance https preview.redd.it jvuk1b3euxo71 jpg width 1616 amp format pjpg amp auto webp amp d42833d2ab773aece0faaad4fc74171b4b18dbe7,-0.9964172840118408,NEGATIVE
2023-09-03,https://www.reddit.com/r/TeslaModel3/comments/1694fy8/tesla_battery_drain_from_vehicle_standby/,11,Plug in Hybrid Electric Vehicle,tesla battery drain vehicle standby,received update tesla resolution vehicle standby battery drainage issues people losing 10 day parked sentry mode cabin protection absurd cost car,-0.9977866411209106,NEGATIVE
2022-08-08,https://www.reddit.com/r/TeslaModel3/comments/wivpcj/the_gas_stations_strictly_only_for_snacks_and/,11,gas,gas stations strictly snacks pics,NA,-0.9756255745887756,NEGATIVE
2022-06-17,https://www.reddit.com/r/TeslaModel3/comments/ve1gpq/the_us_states_with_the_most_electric_vehicles/,11,"Battery Electric Vehicle,Hybrid Electric Vehicle",u.s electric vehicles,NA,0.9694070816040039,POSITIVE
2022-12-22,https://www.reddit.com/r/TeslaModel3/comments/zsvxrj/1_year_and_53k_km_with_a_model_3_in_prairie_canada/,12,"Battery Electric Vehicle,Plug in Hybrid Electric Vehicle,Hybrid Electric Vehicle,fuel",1 53k km model 3 prairie canada,"model 3 ago hard reviews cars cold cold 40 cold figured write review discuss costs ice vehicle previously owned picked 2022 tesla model 3 range december 31 passed 53000km outstanding performing incredibly ve added ppf entire front tinted windows rear rally armor flaps mountain pass performance skid plate winter wheels michelin ice snow winter tires hub caps standard wheels summer increase efficiency live 35km town town day week daycare 900km round trip 2 front facing car seats bought kid booster previous vehicle 2010 lexus rx350 paid fuel costs decided plunge electric money sale vehicle payment 6ft tall legs comfortable model 3 rx350 originally expecting buy chevrolet bolt euv recalls couldn buy decided awd requirement live wife strongly prefers alternatives considered vw id 4 hyundai ioniq 5 ford mach wait hyundai vw minimum 2 local ford dealer combined prices ground clearance wasn huge factor truck drive snows tesla supercharging network infinitely prairies car parked heated 5c garage round installed nema 14 50 outlet charge max 18 amps charge 32 amps fast mobile charger included vehicle 14 50 adaptor plugged battery set maximum charge 80 winter schedule departure time app lifetime average 207 wh km power home costs 0.15 kwh average 5 km 1 kw power 100km costs 3 home charging pretty climate main reason bought car save money drive lot normal math simple justify total public charging costs 1137 home power usage increased 9700 kwh 1455 free chargers total power cost 2592 previous vehicle averaged 13l 100km premium fuel conservative estimate 1.75 fuel price total fuel cost 12,057 13l 1.75 22.75 100km 53000 100 530 530 22.75 12,057 previous vehicle conservatively required 1000 maintenance annual cost 13,057 total maintenance cost ev 150 brake service cabin air filters 1 ev saved 10,315 driving cost 12,057 1000 2592 150 10,315 including price car payment saved 2700 properly factor paying gas 100 depreciation paying car 100 depreciation concern heat 35c 31f highway temperature times plenty temperatures experience 35c vehicles ford 150 toyota tundra lexus rx350 dodge ram previous honda civic heat instant wait engine warm starts throwing heat app 5 minutes 35c interior toasty warm incredible summary saved 2700 purchasing ev extremely happy purchase drive absolutely sense purchase love driving highly recommend solar spring operating costs excited",-0.9819337725639343,NEGATIVE
2023-09-12,https://www.reddit.com/r/TeslaModel3/comments/16guhr5/132_hours_parked_04_kwh_used/,12,Battery Electric Vehicle,132 hours parked 0.4 kwh,"questions parked battery drain owners battery drain set car correctly sentry mode cabin overheat protection force close tesla app leave car june 2021 3 lr 43,000 miles owned tessie app",-0.9961451292037964,NEGATIVE
2022-12-20,https://www.reddit.com/r/TeslaModel3/comments/zqxlaq/apple_music_on_tesla_appears_to_use_the_heaac/,12,environment,apple music tesla appears aac codec 64 kbps explanation testing inside,arse simple testing opinion apple aac codec 64 kbps streaming apple music tesla ui testing methodology results methodology iphone 14 mobile hotspot hotspot monitor data usage https apps.apple.com app hotspot monitor data usage id1037580658 apple app store monitor data traffic 2019 model 3 2022.44.25.1 2021 model 2022.44.25.3 indication bitrates adjusted versions monitor data usage car streaming music match data usage song apple's claims codec apple music settings minute song https imgur.com grt5qib 1.5mb aac 64k 6mbfor aac 256k 36mb lossless alac 145mb res lossless 24 bit 192khz results multiple songs observed pattern burst data track trickle data song appears buffer song pause tracks average 2mb track 1.7mb initial burst 0.3mb track consistent aac standard songs 3 minutes length leads apple aac codec 64 kbps questions concerns update questions comments apple aac codec reasonable guess apple specific codecs 4 quality settings apple music tesla's ui streams apple music highly apple codec unique specific application size catalog hidden lower setting 32 kbps embedded applications question bitrate lte benefit nerfing bitrate wifi compared lte benefit nerfing lte tesla bulk buys data premium connectivity subscribers incentive sound 1 car isolated quiet listening environment virtually impossible quality lossy lossless compression environment multiple listening tests notes 10 13 https en.wikipedia.org wiki efficiency_advanced_audio_coding cite_note 10 shown users difference aac 64 kbps mp3 quality encoder 128 kbps isolated environments apple tesla automotive tesla incentive minimize data consumption premium connectivity stream bluetooth quality 256 kbps aac lossless 1 premium connectivity convenience pay apple music bt yield sound quality reason premium connectivity save money 2 quality aac 256 kbps play aac bt lose additional quality phone car lossless debate transcode aac sbc introducing amount additional battery drain benefit aac worst sbc sounds slightly worse quality tesla amp apple limitation offline storage bitrates personal bet apple limiting choices tesla choosing lower highly speculative source apple embedding apple music javascript tesla javascript ui app interfaces safe bet tesla pulling link https developer.apple.com documentation musickitjs musickit playbackbitrate smithre4 apple music's embedded application support streaming offline bitrates set 256 kbps standard 64 kbps,-0.9977335929870605,NEGATIVE
2021-05-15,https://www.reddit.com/r/TeslaModel3/comments/nctrol/are_electric_cares_really_better_for_the/,12,environment,electric cares environment,NA,0.9894394278526306,POSITIVE
2024-07-10,https://www.reddit.com/r/TeslaModel3/comments/1dzx1s5/cabin_overheat_protection_while_plugged_in/,12,"sustainability,sustainable",cabin overheat protection plugged,cars option unplugged plugged source sustain charging load overheat protection feature easy software implementation imagine happen official suggestion box fill owner btw,-0.9958909749984741,NEGATIVE
2022-02-07,https://www.reddit.com/r/TeslaModel3/comments/smdmzk/electricity_question/,12,Plug in Hybrid Electric Vehicle,electricity question,wondering leaving charger plugged garage wall outlet time unnecessarily increasing electric bill bought wall charger hanger kit bit ocd plugs cord lying floor leave charger plugged time kit includes support piece wall plug charging car ago friend told leave phone chargers plugged outlet time draw juice charging phone running electric bill friend correct advance,-0.9959288239479065,NEGATIVE
2023-12-06,https://www.reddit.com/r/TeslaModel3/comments/18cbfgl/error_messages_after_update_to_20232712_2018_m3_lr/,12,"Plug in Hybrid Electric Vehicle,Hybrid Electric Vehicle",error messages update 2023.27.12 2018 m3 lr,NA,-0.9924290776252747,NEGATIVE
2023-10-04,https://www.reddit.com/r/TeslaModel3/comments/1700bl9/first_camping_trip_in_the_new_tesla/,12,gas,camping trip tesla,glamping cabin kids loved ride free level 2 charger site feel leveled nice doable hit gas stations,0.9947139620780945,POSITIVE
2023-10-21,https://www.reddit.com/r/TeslaModel3/comments/17czgsz/first_time_seeing_dual_plug_supercharger/,12,Plug in Hybrid Electric Vehicle,time dual plug supercharger,stopped dual plug supercharger israel ccs type 2 plugs charge teslas vehicles evs israel carry plugs type 2 ac ccs dc,-0.980090320110321,NEGATIVE
2020-08-15,https://www.reddit.com/r/TeslaModel3/comments/iabb9o/fsd_and_level_5_autonomous_driving_how_do_you/,12,autonomous,fsd level 5 autonomous driving tesla offers compares production ready labs read poll post voting inside,fsd controversial confrontational polarizing topic tesla owners don fsd waste money camp love regret basic autopilot love agree perfect fsd added features closer level 5 close level 3 depending ap feel true fsd 5 10 personally won car happen pretty cameras computers won support tesla software don access question super development alpha pre alpha type lab stuff beta software stuff held testing regulatory approval ready fsd masses fair judge fsd super farther don ready held reason poll assume current fsd 3 perfect level 5 fsd assume car doesn steering wheel 10 ready beta pretty close ready prime time tesla view poll https www.reddit.com poll iabb9o,-0.9667115807533264,NEGATIVE
2018-07-15,https://www.reddit.com/r/TeslaModel3/comments/8z1ioi/getting_gas/,12,gas,gas,NA,0.7540615797042847,POSITIVE
2018-05-08,https://www.reddit.com/r/TeslaModel3/comments/8htlgq/i_just_realized_how_much_ill_be_saving_in_fuel/,12,fuel,realized ll saving fuel costs,figured actual costs mile giving mini cooper 25mpg 25 miles day 5 days week model 3 week charge 1 _per charge_ due special arrangement save 60 month fuel costs doesn count driving figured saving 2k gas car don didn figure nuts,-0.9848628640174866,NEGATIVE
2022-01-18,https://www.reddit.com/r/TeslaModel3/comments/s72mra/i_like_tesla_because_the_car_is_cool/,12,environment,tesla car cool,people irl lot comments talking lame ass environment bro driving car fast cool cool ferrari lamb guys talking green ride bikes denmark true net,0.9996926784515381,POSITIVE
2020-08-05,https://www.reddit.com/r/TeslaModel3/comments/i4ef46/i_put_gas_in_my_model_3_today/,12,gas,gas model 3,NA,-0.9294382929801941,NEGATIVE
2024-01-26,https://www.reddit.com/r/TeslaModel3/comments/1abf32x/ice_drivers_fired_up_someone_evd_their_pump/,12,fuel,ice drivers fired ev pump,NA,-0.9942598342895508,NEGATIVE
2024-09-12,https://www.reddit.com/r/TeslaModel3/comments/1fex3bo/receiving_delivery_this_weekend/,12,"Plug in Hybrid Electric Vehicle,Hybrid Electric Vehicle",receiving delivery weekend,finally tesla 24 model 3 lr awd moment ve waiting decade finally coming true excitement share fellow tesla owners owning 8 ice vehicles adult life finally time ev solar system home garage charging solution boot ve passionate evs 2003 experience building light weight single person electric vehicles school classmates fabricate entire ev scratch school race schools statewide learned program attribute experience seed inspired passion renewable transportation tesla finally evs cool mark time purchasing car brand previous car ve owned purchased private sale couple car dealerships horrid experience buying app pleasant legitimately don happening pinch love,0.9811150431632996,POSITIVE
2023-03-02,https://www.reddit.com/r/TeslaModel3/comments/11fwul6/tesla_is_great_even_at_wrongdoing/,12,autonomous,tesla wrongdoing,statement addressing recall tesla declared technology level semi autonomous driving system advanced level system developed rolled rival car makers https www.drive.com.au news tesla driving level 2 autonomous text 20a 20statement 20addressing 20the 20us 20recall 2c 20tesla 20declared 20its 20technology 20is 20a 20 e2 80 98level 20two e2 80 99 20semi 2dautonomous 20driving 20system 20 e2 80 93 20not 20the 20more 20advanced 20 e2 80 98level 20three e2 80 99 20system 20which 20is 20already 20being 20developed 20and 20rolled 20out 20by 20rival 20car 2dmakers,-0.993118166923523,NEGATIVE
2021-02-05,https://www.reddit.com/r/TeslaModel3/comments/ld3pur/tesla_model_3_awd_long_range_vs_bmw_330e_ukgb/,12,fuel,tesla model 3 awd range bmw 330e u.k gb,hey reddit wondering based u.k buying tesla model 3 lr bmw 330e homework tesla slightly cheaper terms calculations total cost motoring monthly fuel insurance real world electric consumption guys u.k preferable spending charging cars home found actual cost insuring car dramatically increase switched car electric tesla a250 mercedes tesla insurance family car car 15k miles commuting nursery run petrol motrhead halves struggle adapt speed torque car baby seat fitting appreciated ct,-0.9789702296257019,NEGATIVE
2024-09-11,https://www.reddit.com/r/TeslaModel3/comments/1fe1gge/tesla_model_3_highland_phone_mounting_thread_with/,12,environment,tesla model 3 highland phone mounting thread pictures reviews,job constantly vehicle taking pictures screen phone consistently communicating coworkers apps easy access documenting controlled slow moving environments parked message coming addressed constantly reach grab phone charging pad distraction phone mounted safe easy viewing noticed plenty threads people phone mount options filled people commenting junk amazon options linked pictures real input mount people leave charger phone distraction mounted yada yada everyone's situation situation 40 minute commute input people phone mount reliable spot quick access start post options people sort input product pictures universal mounts past failed year's time ago switched proclip usa solely vehicles issues amazing product highland previous generation model 3 mount terrible spot vent left jerry rigged setup clean functions intended input owners previous generation model 3 model appreciated generation model 3 attached pics locations functional short amount time spent car,-0.9970466494560242,NEGATIVE
