date_utc,url,comments,matched_keyword,cleaned_title,cleaned_text,overall_sentiment_score_post,overall_sentiment_post
2019-08-17,https://www.reddit.com/r/TeslaModel3/comments/crrvb4/a_great_comparison_and_explanation_of_how/,0,autonomous,comparison explanation autonomous vehicles usual tesla standard bearer,NA,-0.9888367652893066,NEGATIVE
2021-06-21,https://www.reddit.com/r/TeslaModel3/comments/o4vwsm/andrej_karpathy_tesla_cvpr_2021_workshop_on/,0,autonomous,andrej karpathy tesla cvpr 2021 workshop autonomous vehicles,NA,-0.881100058555603,NEGATIVE
2023-03-23,https://www.reddit.com/r/TeslaModel3/comments/11za31a/apple_autonomous_vehicle_drivers_grow_to_over_200/,0,autonomous,apple autonomous vehicle drivers grow 200 collision january,NA,-0.9590358734130859,NEGATIVE
2023-10-10,https://www.reddit.com/r/TeslaModel3/comments/174f7jc/changes_to_the_nsw_ev_rebate_1_jan_2024/,0,"Plug in Hybrid Electric Vehicle,Hybrid Electric Vehicle",nsw ev rebate 1 jan 2024,share australia contemplating tesla 2024 https preview.redd.it 4v73inibubtb1 png width 614 amp format png amp auto webp amp a1d550b8e014b56cf40cf4457174c0d56241e4e3,-0.9878431558609009,NEGATIVE
2021-10-26,https://www.reddit.com/r/TeslaModel3/comments/qfx348/chinese_ev_maker_xpeng_launches_upgraded/,0,autonomous,chinese ev maker xpeng launches upgraded semi autonomous driving features challenge tesla,NA,0.9780092239379883,POSITIVE
2016-05-07,https://www.reddit.com/r/TeslaModel3/comments/4i9mfo/hmm_i_think_theyre_missing_someone_here_2017/,0,autonomous,hmm missing 2017 chevrolet bolt nissan leaf autonomous driving fight begins,NA,-0.998618483543396,NEGATIVE
2023-05-16,https://www.reddit.com/r/TeslaModel3/comments/13jhobu/is_the_first_quantitative_reliability_data_of_the/,0,fuel,quantitative reliability data model 3 tesla doesn release,"edit data battery failures article notes gathered data 12v hvb tesla model 3 annihilated internal combustion engine ice counterparts reliability study germany incredible mechanical simplicity electric vehicles surprise evs average significantly reliable fossil fuel powered counterparts study german vehicle analysis firm adac highlighted reliability advantage finding tesla model 3 handily beats vast majority gas powered competition adac study primarily focuses vehicle breakdowns annual study vehicles age includes electric vehicles sold german market including tesla model 3 bmw i3 volkswagen id 3 renault zoe adac data electric vehicles lead gas counterparts average tesla model 3 beat gas vehicles evs average reliability wide margin adac found 1,000 2020 model tesla model 3s 1.1 vehicles broke annually surprisingly slight increase 2019 model 3 0.9 breakdowns 1,000 units comparatively average gas vehicle 6.9 breakdowns 1,000 units average ev 4.9 breakdowns 1,000 units tesla bmw i3 vw id 3 shined reliable ev segment size classes cars scored 0.2 breakdowns 1,000 units noted adac study vehicles benefit fewer units road potentially skewing data strangely common breakdown gas electric vehicles share common top breakdown reason dead battery ice vehicles study references starter battery remains unclear statistic reference 12 volt battery larger vehicle battery found evs source https www.adac.de rund ums fahrzeug unfall schaden panne adac pannenstatistik fbclid iwar0lzvzqpmr3kfk7kxufxrpmo6ezpzwp5q9ay8h_c1hfudgbmzs3pcjaofu https www.teslarati.com tesla model 3 crushes reliability study",-0.9843444228172302,NEGATIVE
2024-03-19,https://www.reddit.com/r/TeslaModel3/comments/1bivvj6/it_would_be_nice_if_audio_volume_was_a_component/,0,"sustainability,sustainable",nice audio volume component driver profile,nice audio volume component profile listen quiet music volume hear husband likes dance pop sustained kiley minogue related hearing damage result,0.9991483688354492,POSITIVE
2020-05-07,https://www.reddit.com/r/TeslaModel3/comments/gf55w9/model_3_surpasses_2020_fuel_savings_predictions/,0,fuel,model 3 surpasses 2020 fuel savings predictions,NA,0.9849082231521606,POSITIVE
2018-08-01,https://www.reddit.com/r/TeslaModel3/comments/93snd1/recruiting_bay_area_tesla_drivers_who_considered/,0,fuel,recruiting bay tesla drivers considered fuel cell vehicle hour interview,researcher arizona university studying people decide buy lease hydrogen fuel cell vehicle fcv realize electric vehicle owners california considered fcv deciding buy tesla reason posting request fcvs hard lists people chose purchase fcv rare event 1 18 age live bay 2 purchased leased ev alternative 3 considered fcvs california love talk recruiting participants interviews hour august 3rd august 9th meet time convenient volunteers receive gift card participation pm schedule interview learn study http www.public.asu.edu mikekuby h2fcv_adoption_study,-0.9850082397460938,NEGATIVE
2023-09-01,https://www.reddit.com/r/TeslaModel3/comments/166rj8n/tesla_opens_up_nontesla_superchargers_in_canada/,0,"Plug in Hybrid Electric Vehicle,Hybrid Electric Vehicle,sustainability,sustainable",tesla tesla superchargers canada 2 locations deer ridge north bay,NA,0.9734363555908203,POSITIVE
2018-08-16,https://www.reddit.com/r/TeslaModel3/comments/97xdn6/tesla_sues_ontario_over_canceled_electric_vehicle/,0,Hybrid Electric Vehicle,tesla sues ontario canceled electric vehicle rebate,NA,-0.9886718988418579,NEGATIVE
2023-01-12,https://www.reddit.com/r/TeslaModel3/comments/109xjuu/teslacorsa_28_is_coming_up_on_january_28th/,0,environment,teslacorsa 28 coming january 28th,season teslacorsa event taking buttonwillow raceway park california saturday january 28 2023 familiar teslacorsa event founded tesla owners experience capabilities cars professionally managed track environment alongside tesla owners enjoy track experience car worries trouble law guided advice experienced racecar drivers tesla enthusiasts spend day track info specific event https www.eventbrite.com teslacorsa 27 buttonwillow raceway park california tickets 499048827477 https www.eventbrite.com teslacorsa 27 buttonwillow raceway park california tickets 499048827477 visit www.teslacorsa.com https www.teslacorsa.com details hope lots month post break community guidelines,0.9748615026473999,POSITIVE
2024-06-23,https://www.reddit.com/r/TeslaModel3/comments/1dmtri6/the_sight_and_sound_of_sustainable_transportation/,0,"sustainability,sustainable",sight sound sustainable transportation,NA,0.999768078327179,POSITIVE
2023-08-26,https://www.reddit.com/r/TeslaModel3/comments/161m6t7/witness_the_power_of_innovation_and/,0,"environment,sustainability,sustainable",witness power innovation sustainability action,https www.tesladiycar.com https www.tesladiycar.com check captivating video showcasing tesla's cutting edge electric vehicles positive impact environment join revolution tesla electricvehicles sustainability,0.9997655749320984,POSITIVE
2022-10-26,https://www.reddit.com/r/TeslaModel3/comments/ye0qtn/xpeng_debuts_xngp_semiautonomous_driving_system/,0,autonomous,xpeng debuts xngp semi autonomous driving system rival tesla,NA,-0.9383002519607544,NEGATIVE
2022-06-05,https://www.reddit.com/r/TeslaModel3/comments/v5926a/you_have_70_reasons_for_a_tesla_model_3_what_else/,0,environment,70 reasons tesla model 3 list,1 start tesla 2 shut tesla 3 walk auto locks 4 front trunk storage 5 hooks groceries frunk 6 storage trunk 7 deep trunk hidden 8 seats fold lay flat 9 camping window 10 tesla card keys 11 connect phone key 12 preheat car world 13 valet mode 14 sentry mode 15 speed limit mode 16 gas 17 oil 18 brake pads tesla regenerative braking 19 phone app exact location 20 hold lights 21 summo 22 schedule service app 23 calendar synced 25 energy app 26 google maps directions supercharging routes 27 built web browser 28 tacc 29 autopilot 30 nav autopilot 31 cabin overheat protection 32 fast 0 60 0 100 33 top speed 34 drawing app 35 fart mode app 36 dog mode 37 romance mode 38 atari games atari 39 location folding mirrors 40 hvac system draggable fans 41 seats car heat fast 42 easy entry 43 driving profiles 44 driving styles sport comfort 45 air updates 46 sound running 47 optional fob model car 48 supercharge network 49 environment friendly 50 red light warning 51 8 battery warranty 52 built dash cam 53 voice controls 54 simple interface screen 55 home link 56 charging dock phone 57 automatic wipers 58 glass roof easy clean 59 blind spot warning 60 j1772 converter cable charging 61 mobile service 62 mobile connecter 63 scheduled charging save money 64 lights front makes night driving peaceful 65 usbs passengers 66 music control app people 67 pin drive 68 waring speed 69 obstacle aware acceleration 70 pre start garage fumes,-0.9917091727256775,NEGATIVE
2024-07-18,https://www.reddit.com/r/TeslaModel3/comments/1e62a4j/6_cash_back_with_applecard_for_ev_charging_till/,1,"Plug in Hybrid Electric Vehicle,Hybrid Electric Vehicle",6 cash applecard ev charging till aug 15th,NA,-0.8818575143814087,NEGATIVE
2023-05-02,https://www.reddit.com/r/TeslaModel3/comments/135znlr/autonomous_vehicle_driver_training/,1,autonomous,autonomous vehicle driver training,NA,0.8062782883644104,POSITIVE
2019-12-02,https://www.reddit.com/r/TeslaModel3/comments/e4rjfj/awd_lr_for_winter_ski_trips/,1,PHEV,awd lr winter ski trips,model 3 awd lr trips bay tahoe summer terrific stops assume winter prudent stop supercharger question concern rav4 hybrid subaru crosstrek phev primarily low clearance model 3 impact snow days takes plowed experience sierra snows comments,-0.9920347332954407,NEGATIVE
2023-08-19,https://www.reddit.com/r/TeslaModel3/comments/15vaqfl/brandnew_online_store_specializing_in_tesla/,1,"sustainability,sustainable",brand online store specializing tesla accessories,brand online store specializing tesla related accessories https www.tesladiycar.com https www.tesladiycar.com thrilled provide platform tesla enthusiasts freely exchange experiences receive support upgrading modifying vehicles mission foster vibrant community individuals explore endless possibilities tesla car ownership enhance driving experience extensive range quality accessories team knowledgeable experts dedicated ensuring tesla owner perfect products guidance customization join exciting journey celebrate world tesla empower fellow enthusiasts dreams reality accelerate future sustainable transportation,0.9987342953681946,POSITIVE
2020-11-30,https://www.reddit.com/r/TeslaModel3/comments/k482a9/clean_vehicle_rebate_project_bay_area/,1,fuel,clean vehicle rebate project bay,options rebates mind buy 2021 m3 tesla giving 1500 california clean fuel rebate deducting amount cost website question eligibility criteria clean vehicle rebate project 1 household income matter married file separately 2 max income till rebate 3 car wife's live florida resident california 2 months apply rebate irs return florida experience clean vehicle rebate project helpful,-0.7352086305618286,NEGATIVE
2021-10-22,https://www.reddit.com/r/TeslaModel3/comments/qdpdhd/fueling_up_my_body/,1,fuel,fueling body,NA,0.9989047050476074,POSITIVE
2023-08-26,https://www.reddit.com/r/TeslaModel3/comments/161x8st/george_washington_bridge_truck_fire_video/,1,fuel,george washington bridge truck fire video,dashcam video truck fire george washing bridge past thursday holy shit smell thinking truck explode diesel fuel road ignite driving past amp x200b https reddit.com link 161x8st video im6bei9fxgkb1 player,-0.9949573874473572,NEGATIVE
2023-04-16,https://www.reddit.com/r/TeslaModel3/comments/12on6r7/had_to_fix_my_fuel_station/,1,fuel,fix fuel station,woke morning charging stopped hour night found cb feeding panel wall charger tripped reset trip lowes 15 minutes charging,-0.9939596652984619,NEGATIVE
2022-07-01,https://www.reddit.com/r/TeslaModel3/comments/vp9tvg/illinois_electric_vehicle_rebate_program_starts/,1,Hybrid Electric Vehicle,"illinois electric vehicle rebate program starts 4,000",NA,-0.9563730359077454,NEGATIVE
2024-03-23,https://www.reddit.com/r/TeslaModel3/comments/1blkevi/looking_to_buy_a_used_20192021_model_3_with/,1,BEV,buy 2019 20 21 model 3 40 60k miles cost 22 23k,completely purchasing bev's option commute inspecting cars tesla warranty purchasing dealership owners manufacturer warranty warranty amp x200b completely cars dumb questions,-0.9994601607322693,NEGATIVE
2024-04-29,https://www.reddit.com/r/TeslaModel3/comments/1cgb1cy/my_2018_tesla_model_3/,1,Hybrid Electric Vehicle,2018 tesla model 3,"grandmother biggest influence life don electric cars car fast loud v8s grandmother vehicle buy persuaded tesla 2024 mylr sunday tesla model monday manual fast cars tesla steers drives acceleration love wasn fan model threes wash set 2023 2020 model driving 18,000 miles love tesla",0.9902216196060181,POSITIVE
2019-07-17,https://www.reddit.com/r/TeslaModel3/comments/ce7iut/new_research_report_ev_owner_experiences_vs/,1,"Battery Electric Vehicle,Plug in Hybrid Electric Vehicle,Hybrid Electric Vehicle,fuel",research report ev owner experiences owners expectations,autothink research released extensive research exploration conducted north american drivers internal combustion engine vehicles hybrids plug hybrids electric vehicles extended range electric vehicles fuel cell vehicles view electric vehicles teslamodel3 participated survey january february promised share results research carefully documents current misperceptions evs knowledgeable automotive enthusiasts people auto industry tesla model model 3 chevrolet volt owners happiest ev owners major finding ev ownership road trip charging infrastructure drivers tesla owners feel constraint hassle taking distance road trips tesla owner view quick page summary report's table contents http autothink.org abstractandtableofcontents.pdf download entire 285 page report https drive.google.com id 13cqm85zuatvhs1offu0snkzjgobqqntx feel free share reports auto industry autothink.org,-0.9057369828224182,NEGATIVE
2020-06-17,https://www.reddit.com/r/TeslaModel3/comments/haxdb0/owning_an_electric_vehicle_in_the_summer/,1,"Battery Electric Vehicle,Plug in Hybrid Electric Vehicle,Hybrid Electric Vehicle",owning electric vehicle summer,NA,0.9979642629623413,POSITIVE
2022-02-17,https://www.reddit.com/r/TeslaModel3/comments/sulkxs/tesla_china_announces_the_launch_of_its_tailgate/,1,Hybrid Electric Vehicle,tesla china announces launch tailgate upgrade service model 3 video electric vehicles,https eletric vehicles.com 2022 02 17 tesla china announces launch tailgate upgrade service model 3,-0.9198240637779236,NEGATIVE
2023-03-17,https://www.reddit.com/r/TeslaModel3/comments/11tvwzr/tesla_oem_tow_bar_electrics/,1,Plug in Hybrid Electric Vehicle,tesla oem tow bar electrics,wondering retrofitted tesla oem tow bar electrics model 3 tow module tow plug uk bit actual question fitted oem kit car coded toolbox trailer mode screen automatic,-0.9952890872955322,NEGATIVE
2022-02-28,https://www.reddit.com/r/TeslaModel3/comments/t3bb8j/teslas_california_factory_the_most_productive/,1,"Plug in Hybrid Electric Vehicle,Hybrid Electric Vehicle",tesla's california factory productive auto factory north america 2021,"report bloomberg january 24 tesla california factory productive auto factory north america 2021 beating 70 competing factories tesla fremont calif plant produce average 8,550 vehicles week 2021 ahead toyota kentucky plant 8,427 bmw south carolina plant 8,343 tesla's fremont california factory originally built motors 1960s affiliated motors 1962 1982 toyota 1984 2009 2010 tesla acquired plant carried scale upgrade june 2012 model tesla rolled production line plant shanghai plant production fremont plant tesla's complete vehicle plant tesla fremont california factory covers 5.3 million square feet texas factory mass produced reaches 7.9 million square feet texas factory exceeds california factory shanghai factory berlin factory largest factory tesla headquarters moved california texas current major auto plants north america toyota kentucky plant 9 million square feet producing 8,427 vehicles week tesla's texas plant 7.9 million square feet start production 2022 bmw south carolina plant 7 million square feet producing 8,343 cars week nissan's tennessee plant 6 million square feet produces 4,900 vehicles week tesla california factory 5.3 million square feet produces 8,550 cars week stlantis michigan plant 5 million square feet produces 6,000 vehicles week ford's missouri plant 4.7 million square feet produces 5,800 vehicles week hyundai kia indiana plant 3.4 million square feet produces 5,600 cars week amp x200b tesla absolute leader field pure electric vehicles output ratio brands 2021 tesla's u.s factories ranked 10th productivity texas factory operation 2022 opportunity push ranking hope real capacity growth wait 2023 texas factory released",0.9817479252815247,POSITIVE
2019-12-16,https://www.reddit.com/r/TeslaModel3/comments/eblars/this_is_how_news_reporters_miss_the_mark_on/,1,Hybrid Electric Vehicle,news reporters miss mark electric vehicle charging,NA,-0.9893865585327148,NEGATIVE
2024-07-17,https://www.reddit.com/r/TeslaModel3/comments/1e5c7wy/2024_model_3_lr_awd_power_consumed_during/,2,environment,2024 model 3 lr awd power consumed charging operations,collective wisdom power 2024 model 3 range awd consumes maintain battery temperature electronic maintenance charging realize environment helps determine assume max ambient temperature 85 degrees direct sun parking garage assistance greatly appreciated twells edit found answer 300w battery cooling charging operations post future,-0.9317929744720459,NEGATIVE
2024-10-13,https://www.reddit.com/r/TeslaModel3/comments/1g2zt2d/brake_replacement_cost/,2,environment,brake replacement cost,brakes lot noise recently 80k miles socal commute 50 miles day heavy traffic environment noise slowly drive slowly parking lot noise squeaky neighbors hear brake burnishing steps improved lot rarely hear noise regen setting hold makes lot noise creep lot appointment tesla 2 weeks expect worst paying replacement whats cost,-0.9891268610954285,NEGATIVE
2019-02-27,https://www.reddit.com/r/TeslaModel3/comments/av6ikn/charging_interrupted_when_another_vehicle_plugs/,2,Plug in Hybrid Electric Vehicle,charging interrupted vehicle plugs level 2,reproduce car charging plug m3 lr rwd start stop charging wattzilla level 2 public chargers disconnects car plugs disconnect car start car restart fine,-0.9973052740097046,NEGATIVE
2024-08-10,https://www.reddit.com/r/TeslaModel3/comments/1eofydk/did_my_first_road_trip_on_my_m3lr_and_got_pretty/,2,fuel,road trip m3lr pretty efficiency,NA,0.9996589422225952,POSITIVE
2021-08-19,https://www.reddit.com/r/TeslaModel3/comments/p7l4xc/first_road_trip_in_a_21_m3p_and_no_issues_951/,2,fuel,road trip 21 m3p issues 951 miles round trip,picked 21 m3p https imgur.com fbxwowz month ago road trip la sedona https imgur.com qpsao9p week time ev drive happy report fantastic experience trip planned route planner https abetterrouteplanner.com recommend drive set drive web browser share trip tesla nav app pulling trip browser paid month premium includes real time supercharger availability chargers issues charging speaking stop charge 2 3 times nice change typical ice road trip broke 7 1 2 hour drive 2 2 1 2 hour chunks driving nice stretch chargers eat explore abrp plans stops charging 50 minutes time 10 20 minutes 50 minute stop eat lunch experience range anxiety abrp stay hotel ev charging stretch driving ehrenberg az la set abrp arrive destinations 30 charge home didn 3rd stop charge az la leg 220 miles 3 hours stop 100 gt 14 time home teslafi saved 131 fuel trip paid 42 supercharging referral miles free driving autopilot stretches learned limitations 80mph stretches speed limit 55 65 won engage traveling 5mph limit huge deal autopilot helped break ride 20 uberturbines fine complaints issues downside speak massacre biblical proportions front car anticipated packed bottle onr microfiber towels bugs didn driving destination car manual car wash power wash introduced road trips tesla wait,-0.9960976839065552,NEGATIVE
2022-12-09,https://www.reddit.com/r/TeslaModel3/comments/zgxjy0/first_time_seen_this_any_real_hope_it_would_be/,2,"sustainability,sustainable",time real hope delivered,NA,0.9998600482940674,POSITIVE
2023-08-21,https://www.reddit.com/r/TeslaModel3/comments/15wsz8l/help_me_out_here_interest_ratetermtell_me_why_im/,2,fuel,rate term dumb,"current vehicle average 16mpg average cost 4 mid grade averaged 1337 miles month 2 cost fuel approximately 336 mo 4,000 current payment 578 mo 2.4 insurance 150 mo model 3 range priced 44,880 qualify 7,500 fed credit 5,000 credit 500 charge install credit 500 referral credit monthly approx 600 tax insurance 200 electricity cost mileage approximately 800 yr netting monthly cost roughly 194 2,300 tesla makes sense issue gather model 3 depreciates slowly vehicle tesla's current 6.1 rate 84 months shopped banks credit unions rate credit score gt 800 advantage current price incentives increasing decreasing monthly vehicle expense sense enter deal tesla's 84 month option plan refinancing rates drop sounds dumb realize decrease term increase monthly expense break current expense prudent guess sort middle ground trouble 84 month amp x200b amp x200b amp x200b",-0.9997944235801697,NEGATIVE
2023-05-23,https://www.reddit.com/r/TeslaModel3/comments/13pcizh/i_think_i_got_lucky_when_i_placed_my_order/,2,"environment,fuel",lucky,NA,0.9998067021369934,POSITIVE
2023-12-14,https://www.reddit.com/r/TeslaModel3/comments/18ibx76/its_getting_chilly/,2,Hybrid Electric Vehicle,chilly,2021 245 20 hakka winter tires,-0.9990490078926086,NEGATIVE
2021-11-25,https://www.reddit.com/r/TeslaModel3/comments/r1wgnj/ive_developed_this_tiny_diy_robot_car_that_will/,2,autonomous,ve developed tiny diy robot car teach kids autonomous driving technologies,albert 22 tech lover creating fun educational electronic devices share project rest named circuitmess batmobile circuitmess batmobile ai powered diy batmobile robot car cooperation warner bros ve kickstarter 8 days info set link https www.kickstarter.com projects albertgajsak circuitmess batmobile ref 535kx4 https www.kickstarter.com projects albertgajsak circuitmess batmobile ref 535kx4 ve designed kit teach cutting edge technologies autonomous cars machine learning computer vision ai iot source arduino compatible hackable honest feedback model https preview.redd.it opk60k0etq181 png width 557 amp format png amp auto webp amp 37366eaac0260ed3da2d85f083a06ca50bf548c3,-0.9715762734413147,NEGATIVE
2024-01-21,https://www.reddit.com/r/TeslaModel3/comments/19c8hqi/malaysian_tesla_model_3_highland_checking_in/,2,Hybrid Electric Vehicle,malaysian tesla model 3 highland checking,pardon parking wasn gear changing method car parked quickly realized aren deep blue metallic fans loved mine bits day 3 owning,0.597072422504425,POSITIVE
2022-12-14,https://www.reddit.com/r/TeslaModel3/comments/zlvh7q/need_some_help_answering_some_questions/,2,environment,answering questions difficulty hard,1 green brake pad lightning bolt inside pressing learned means regen braking temporarily reduced question happening temperature colder cali time ve symbol 2 top picture auto pilot dots limit regen braking autopilot disappear hidden autopilot follow standards driver 3 apply brakes regen limited understand applies brakes regen bad hazardous environment isn regen brakes technically bad hazardous environments conditions car ultimately braking accessible amount brakes reduced,-0.9992263317108154,NEGATIVE
2024-06-02,https://www.reddit.com/r/TeslaModel3/comments/1d6iphf/running_the_numbers_between_budget_ev_and_hybrid/,2,fuel,running budget ev hybrid,"ev hybrid comparison spreadsheet https docs.google.com spreadsheets 1k1pjtigyo4nfhjzqtu51jlmg78q_g7to18shbceijca edit usp sharing spending past couple months running owning efficient hybrid versus budget ev conclusion cheap home charging consistent free public charging drive lot miles month 1500 hybrid choice calculations hybrid chose corolla hybrid version live california gas prices 5 gallon cost maintenance insurance repairs fuel costs roughly consistent ev chose tesla model 3 evade cost 25,000 2 qualify 4,000 electricity provider southern california edison 4,000 pre owned electric vehicles qualify low household income cost electricity 33 cents kilowatt flat rate 500 kilowatts month cost increases 43 cents time usage rate tou prime 25 cents kilowatt peak hours electricity usage peak hours 4 00 p.m 9 00 p.m 63 cents kilowatt hour flat rate scenario upfront cost tesla significantly cheaper cost month ownership roughly efficient hybrid simply due electricity cost insurance renewals fees ev's pay gas pay gas tax road maintenance cost registration fee electricity costs low drive lot month sense electric vehicle hybrid makes sense account batteries forever car companies offer pretty warranty battery 8 100,000 miles warranty luck terms battery pay experience online rarely people battery battery 70 capacity left voltage battery stops randomly due bad cells stops charging people replaced warranty refurbed pack summary ev saving money drive lot miles amount day 80 main justification buying ev driving experience electric vehicles road trips charge home easily",-0.9885308742523193,NEGATIVE
2019-06-29,https://www.reddit.com/r/TeslaModel3/comments/c70fys/so_sexy_in_the_rain/,2,"Plug in Hybrid Electric Vehicle,Hybrid Electric Vehicle",sexy rain,smokey alittle months day love rain baby https imgur.com 6hapcvf tinted chrome deleted 19ins wheels tires installed satin black week transformation complete fence electric vehicle test drive opinion amazing experience glad tesla companies realized evs stay,0.9998550415039062,POSITIVE
