date_utc,url,comments,matched_keyword,cleaned_title,cleaned_text,overall_sentiment_score_post,overall_sentiment_post
2020-05-24,https://www.reddit.com/r/TeslaModel3/comments/gpv9r8/my_cross_country_drive_a_supercharger_summary/,27,"Battery Electric Vehicle,battery,gas",cross country drive supercharger summary,recently traveled york los angeles 2019 tesla model 3 lr awd 18 aero wheels named marvin spending couple months mom covid 19 crisis decided head home la restrictions loosening ny time departure mom minimal breaks sightseeing traverse country figured write experience summary statistics total distance kwh efficiency total cost happy answer questions trip tl dr 4 days 3103 mi 269 wh mi 130.86 night 0 day 1 stony brook ridgewood stayed night family charge night woke 8 started west charging stop allentown pa drive pleasant suburban highways driving 2 lane traffic autopilot flawlessly 1 toll bridges route calculate total miles efficiency ridgewood allentown portion roughly 100 miles 253 wh mi allentown supercharging spot strip mall eateries drive fast food including jamba juice breakfast smoothies 8 stalls 150kw speed 120 roughly 30 minutes 1 car obvious public restroom stop clean maintained unremarkable cleanliness 5 5 services 3.5 5 availability 4 5 accessibility ease highway 5 5 speed 4.5 5 scenic views 2 5 4 5 total price 14.31 drive somerset 210.3 miles 260 wh mi beautiful mountains tunnels route allentown somerset winding pa turnpike blue ridge mountains incredible rural pa super pleasant drive bit construction brought lane 40 mph speed limit due light traffic autopilot handled construction zones abundance caution toll pa turnpike due bill mail somerset pa supercharging spot highway eatery wendy's spot accessible restroom charging spot verizon wendy's car wash dance studio advertised 120 kw power 6 stalls car half hour charging station exceptionally maintained clean cleanliness 4 5 services 2 5 availability 4 5 accessibility 4 5 speed 4.5 5 scenic view 1 5 3 5 total price 13.52 drive cambridge 154.8mi 236 wh mi nice scenic drive forest western pennsylvania country interstate roads west virginia eastern ohio left somerset started raining lightly slowed bit 70w closed wheeling wv detour 470 autopilot issue construction zone lane lines visible diverging lines left car lane staying straight toll highway due bill mail cambridge supercharging spot sheetz gas station mile highway traffic light left heading highway serves primary eatery restroom denny's door 300 foot walk bathroom clean parking lot strip mall dollar guess pick car 8 stalls pulling 125kw dropped 100 kw 60 charged pleasant experience cleanliness 4.5 5 services 3 5 availability 4.5 5 accessibility 5 5 speed 4.5 5 scenic view 2 5 4 5 total price 5.64 drive cincinnati 177.6 mi 273 wh mi stop columbus driving columbus rated 160 miles 100 miles cincinnati 10 left battery entered columbus scenery shifted wooded plains skies heavy thunderstorms caused autopilot unavailable control immediately message popping heavy rains dropped efficiency pretty significantly leg journey slow bit cincinnati charge comfortable strenuous enjoyable leg journey driving rain beautiful control cincinnati supercharging spot meijer supermarket parking lot 2 miles highway traffic lights gps delivery loading docks spots charger freshly paved stark contrast rest lot parking lot target accesible bathrooms food meijer supermarket garbage cans chargers charge car charging 10 stalls started pulling 120kw dropped charging session fine location bit difficult cleanliness 4.5 5 services 3 5 availability 4.5 5 accessibility 3 5 speed 4 5 scenic view 2 5 3.5 5 total price 7.15 drive louisville ky 104.2 mi 262 wh mi cincinnati city drove view baseball football stadiums highway roads manageable woodsy highway kentucky surprised highway patrol cars lights shoulder dusk finally checked hotel 10pm day driving hotel 3 miles supercharging station forgot track actual distance usage short bit day 2 louisville supercharger located college annex building's parking lot bakery sadly shut stalls nice note actual power draw walked bakery closed garbage cans lot coffee shop easy walking distance street station highway easy 1 car 8 stalls cleanliness 4 5 services 2 5 availability 4.5 5 accessibility 5 5 speed 5 scenic view 3 5 3.5 5 total price 4.94 drive bowling green ky 113.5 mi 271wh mi rainy segment skies exited louisville closed entered bowling green 3 lane highway easily navigable bowling green ky supercharger located meijer supermarket field 4 miles highway accessible road tripping purposes pleasant suburban drive charger county roads meijer shops eateries easy waling distance car 8 stalls pulling 100 115kw nice spot cleanliness 4 5 services 2 5 availability 4.5 5 accessibility 2 5 speed 3 5 scenic view 4 5 3 5 total price 3.75 drive dickson tn west nashville 102.5 mi 264wh mi stopped lunch cousin suburbs easy pair segments nice transition mountainy roads beautiful scenery view nashville skyline dickson tn supercharger holiday inn express 2b appears damaged car 8 chargers 130 kw restaurant nearby walking distance nearby trash easy highway cleanliness 4 5 services 2 5 availability 4.5 5 accessibility 4 5 speed 4 5 scenic view 3 5 3.5 5 total price 3.30 drive jackson tn 94.6mi 260 wh mi special pleasant wooded road paved fast moving jackson tn supercharger nicest supercharging spot trip spot bit awkward 40w exit takes surface street luckily street drive throughs guilty pleasure southern cookout eat store traditional bakery time explore gift shop train museum play round mini golf closed due pandemic classic pullman car directly front chargers cool atmosphere highly recommend stop top pay attention charging speed plenty fast car 8 stalls blink chargers installed tesla cleanliness 4 5 services 5 5 availability 4 5 accessibility 2 5 speed 5 scenic view 5 5 4.5 5 total price 3.52 drive memphis tn 74.9mi 267 wh mi wooded segment similar due 240 view memphis skyline fine memphis tn supercharger strip mall free standing horizon bank accessibility highway eateries bathroom taco bell nearby nice option clean garbage cans chargers 2 cars pulling 90kw slowest charge trip special slow wrong cleanliness 4 5 services 5 5 availability 4 5 accessibility 5 5 speed 3 5 scenic view 5 5 4.5 5 total price 3.89 drive rock ar 168.5mi 245 wh mi detour exterior graceland memphis cool exciting landscape bit wooded background mix farmland wooded nice view rock city highway construction drive traffic experienced due accident memphis rock ar supercharger outlet center mall hooters movie theater view pretty nice flower beds excellent landscaping close highway gps exit easy highway garbage chargers plenty mall 2 cars 10 spots pulling 140 kw nice stop cleanliness 5 5 services 5 5 availability 5 5 accessibility 4.5 5 speed 4.5 5 scenic view 4.5 5 5 5 total price 4.08 drive texarkana tx 135.3 mi 273 wh mi thunderbolts lightning frightening heavy thunderstorm restricted ability autopilot stretch drive manually cruise control returned auto lane change disabled bolts lightning sky incredible backdrop texarkana tx supercharger olive garden outskirts mall highway service road miss parking lot texas navigating service roads tricky missed ramp added 2 miles trip exit ramp charger confusing time coming 30w station nice car 8 spots roughly 135 kw maintained finding bit issue cleanliness 4 5 services 2 5 availability 4 5 accessibility 3 5 speed 4.5 5 scenic view 2 5 3 5 total price 3.30 day 3 drive sulphur springs tx 97.5 mi 299 wh mi speed limit jumped 75 entirety stretch drove efficiency set cruise control 82 mph entirety stretch ranches couple huge churches easy drive sulphur springs tx supercharger stand parking lot police station highway quick ramp cross couple lanes 500 feet highway exit charger 2 mile scenic drive residential neighborhood classic american town main street love visit tesla spots nice brick paving maintained 8 spots car pulling 140 kw location park walk cleanliness 5 5 services 4 5 availability 4 5 accessibility 3 5 speed 4.5 5 scenic view 5 5 4 5 total price 3.96 drive arlington tx 95.8 mi 268 wh mi transition 2 lane highway rural texas 5 lane highways dallas metroplex thick fog persistent rain view dallas skyline coming highway view flags perspective taller titan texas giant rides prior experience arlington tx supercharger located sports arena easy highway mile views amp stadium globe life ballpark bit flags park manicured lawns surrounding portion parking lot overlooks pond accessible game day 10am saturday events plenty 10 stalls car drawing 100 kw central activities location food bathroom options nerby trash eat charger cleanliness 4 5 services 1 5 availability 4 5 huge issue rangers game accessibility 5 5 speed 3.5 5 scenic view 5 5 3 5 total price 4.29 drive cisco tx 121.6 mi 353 wh mi pouring rain 5 miles cisco autopilot entire leg nice plains dallas fort worth metroplex cisco tx supercharger located flying shell gas station denny's addition 8 supercharger outets single 1772 appears free check bathrooms insude gas tation windshield cleaners gas station outdoor seating easy highway maintained car puling arorund 130 kw cleanliness 4 5 services 4 5 availability 4 5 accessibility 5 5 speed 4.5 5 scenic view 2 5 4 5 total price 3.30 drive sweetwater tx 86.4 mi 303 wh mi leg uneventful splashed huge mud pile driver car wash notice driving car delicious steak fries lunch local eatery charging sweetwater tx supercharger holiday inn express 2 cars 8 spots 90 kw couple guys rode single wheel electric skateboard type called exciting garbage hotel usable bathrooms fine food walking distance cleanliness 4 5 services 2 5 availability 4 5 accessibility 5 5 speed 3.5 5 scenic view 2 5 3 5 total price 4.40 drive midland tx 113.5 mi 276 wh mi 0 leg pretty cool oil fields processing plants lot wide road country views disappointed 10 miles straight road stripped textured pavement giving loud bumpy ride midland tx supercharger suburban extended stay hotel door love's gas station souveniers love's shop pretty cool texas highway easy easy hard food gas station nearby garbage view pretty meh clean car 8 spots drawing 140 kw cleanliness 4 5 services 2 5 availability 4 5 accessibility 5 5 speed 4.5 5 scenic view 2 5 3.5 5 total price 3.96 drive pecos tx 90.1 mi 259 wh mi beautiful mountain shaddows backdrop wide road speed limit 80 surprised efficiency speed ac strong 94 hot sun pecos tx supercharger extremely easy easy service road flying travelodge travelodge nice gazebo sit chargers size convenience store flying trash cans restrooms 8 chargers car ulling 130 kw pretty speed charge cleanliness 4 5 services 3 5 availability 4 5 accessibility 5 5 speed 4.5 5 scenic view 3 5 4 5 total price 1.26 drive van horn tx 90.2 mi 311 wh mi wild flowers bushes windshield insect graveyard super easy drive transition plateaus beautiful van horn tx supercharger located hampton inn amenity bathrooms easy walking distance hampton inn stop easy highway simple views mountains pretty nice lot space car pulling 30 60 kw 4a heading leg outdoor garbage left bag trash charger box bottom stations visited trip cleanliness 3 5 services 1 5 availability 4 5 accessibility 4 5 speed 1 5 scenic view 3 5 2 5 total price 6.27 drive el paso tx 131.1 mi 272 wh mi drive el paso pretty mountain backgrounds surroundings nice ciudad juarez driving spent sunlight texas driving west leaving 7am central traffic el paso tx supercharger located rudy's bar hampton inn easy highway access missed learned touchless automatic car wash half block west drive front windshield jackson pollock painting fly caracasses decided sadly hand machine broken recommend 2 teslas taking chargers charger iced family picnic charging spot truck starting teslas west facilities pretty fine maintained sharing 4a 4b park truck pulling 120 kw spot stop pretty greenery cleanliness 5 5 services 5 5 availability 3 5 accessibility 5 5 speed 4.5 5 scenic view 3 5 4 5 total price 3.08 drive deming nm 91.6 mi 289 wh mi dark drive easy border control checkpoint west las cruces simple sleep charging deming nm supercharger located valero gas station 8 chargers car roughly 130 kw power chargers building easy poorly lit valero pretty selection bathroom garbage stop 1 mile north highway real green space walk couple cute cacti gas station cleanliness 4 5 services 2 5 availability 4 5 accessibility 4 5 speed 4.5 5 scenic view 3 5 3.5 5 total price 5.04 day 4 drive wilcox az 139.4 mi 274 wh mi beautiful desertscapes easy drive smooth highway charging previous night backtrack bit hotel wilcox az supercharger located holiday inn express mile highway pretty ugly truck parking garbage bathrooms hotel 8 stalls 1 car 120 kw cleanliness 4 5 services 2 5 availability 4 5 accessibility 5 5 speed 4 5 scenic view 1 5 3 5 total price 5.52 drive casa grande az 146.5 mi 232 wh mi absolutely love desert landscape amazing natural rock formations favorite set scenery drive drive tucson tucson ugly highway couple instances autopilot detected service road thinking speed limit lower causing basically brake check pretty smooth drive casa grande az supercharger located chase bank strip mall set food options maintained 3 cars 8 spots 110 kw easy highway exceptionally easy nicely manicured rockscape unfortunely chargers parked facing active roadway alleyway basically driveway cars flying cleanliness 4.5 5 services 4 5 availability 4 5 accessibility 4.5 5 speed 4 5 scenic view 3 5 4 5 total price 2.50 drive buckeye az 84.6 mi 226 wh mi stopped phoenix quick socially distanced walk park friend driven phoenix nice views city's skyline segment plenty pleasant manicured desert views hank hill phoenix testament man's hubris buckeye az supercharger location highway strip mall carl's jr plenty food options bathrooms extremely easy highway access 3 cars including 8 charging spots roughly 110 kw mall fine job landscaping exciting stop time travel phoenix pleasant cleanliness 3 5 services 4.5 5 availability 4 5 accessibility 5 5 speed 4 5 scenic view 2 5 4 5 total price 3.75 drive ehrenberg az 116.9 mi 291 wh mi nice desertscape mountains easy drive boring ca ehrenberg az supercharger easy roundabout located western flying wendy's bit green space front chargers giant gas tank weird smell 8 chargers 3 teslas 1 ice half minute drawing rated 250 kw settled 170 charging session stop quartzsite location 15 miles highway offers cleanliness 4 5 services 4 5 availability 4 5 accessibility 5 5 speed 5 5 scenic view 3 5 4 5 total price 6.89 drive cabazon ca 140.4 mi 296 wh mi portion times visit palm desert times drive windmills cool nice drive highway reminds home cabazon ca supercharger located outlet mall variety shops mcdonalds outlets pull forward stalls dozen stalls wait due heavy traffic past lot trash dumpster couple stations easy ca superchargers pay kw minute leading total price supercharging double rate chargers country consistent 110 kw cleanliness 2 5 services 4 5 availability 3 5 accessibility 5 5 speed 4 5 scenic view 2 5 3.5 5 total price 9.24 drive home 114.8 mi 215 wh mi live san fernando valley navigate autopilot variety freeway interchanges finally home incredible road trip circumstances shocked easy hope experience plan massive trips ev day 1 746.9 mi 257.5 wh mi day 2 689.3 mi 262.1 wh mi day 3 917.8 mi 292.8 wh mi day 4 742.6 mi 258.0 wh mi total 3103 mi 269 wh mi 130.86,-0.8609112501144409,NEGATIVE
2018-08-05,https://www.reddit.com/r/TeslaModel3/comments/94skst/my_personal_observations_experience_and_thoughts/,27,Battery Electric Vehicle,personal observations experience pick,bit background model 3 ev nervous majority feeling excitement drove 370z prior model 3 love handling decent 0 60 fun vehicle drive unique car buying experience bought 2 cars tesla offers unique buying experience revolution view awesomely simplify process lot honestly surprise set congratulations 40 minutes fast buying major car bad easy easy forgot copy sales contract record time experience model 3 168 miles checked santana row dinner charge car learned lessons time user observations bit unlucky charging station lot headache charge release pull unlock charging cable unlocked phone control center fortunately tesla showroom managed unlock figure fortunately wife faulty charging cable blink ev charging station unlock detach tesla connector adapter unlocking mobile app control center trick apps charge car yesterday blink signal awful ev model 3 quiet coming sport car personally overwhelmed technology model 3 unconventional idea home car intimately crowded mall saturday night car brakes release accelerator screen wow love perfect size screen bigger photos perfect size reviewers ui difficult completely true learning curve intuitive makes difficult driving glove box minority glovebox driving easier reach glove box reviewers complain dashboard nervous love simplicity bigger real estate view road fantastic absolutely fantastic training move mobile phone battery mentality time battery hit 60 70 panic quickly charging station battery dies sort moments yesterday checking battery left versus mileage change car fantastic wife cars car completely overwhelmed greatness car love,0.9971601963043213,POSITIVE
2024-03-12,https://www.reddit.com/r/TeslaModel3/comments/1bd93zm/on_the_fence_about_buying_a_tesla/,27,fuel,fence buying tesla,sound silly ve heard teslas drive volkswagen gti 2021 160k km 100k miles trade tesla 2020 tesla model 3 110k km 68k miles car selling 28000 cad 21000usd guys greatly appreciated driven 2022 model 3 owners feedback 2021 2020 solid model,0.9486664533615112,POSITIVE
2023-04-12,https://www.reddit.com/r/TeslaModel3/comments/12j5awl/regen_limited_below_70_f/,27,"BEV,PHEV",regen limited 70,ve owned 2023 m3 rwd month pacific northwest temperatures average 40 50 time ve noticed green circle symbol limited regenerative braking time experience phevs honda clarity bevs ford mach past limit regenerative braking cold temps 40 40 routes commonly drive mild hills model 3 barely regen pedal driving engaging regular brakes electric vehicles ve experienced regeneration routes temperatures contacted tesla received call tesla publish spec cold limits regen tech phone battery temp 70f limit regen similar experience receive similar info surprised learn tesla regenerative braking system robust honda ford manufacturers wondering car defect causing severe limitation regen normal tesla remote analysis car data car normal true guess fix change disappointed car regen 9 months climate live cool cold models honda ford issue,-0.9867764115333557,NEGATIVE
2022-02-21,https://www.reddit.com/r/TeslaModel3/comments/sxyg0o/autocross_with_a_tesla_is_so_much_fun_and_a_great/,28,Battery Electric Vehicle,autocross tesla fun learn limits vehicle doesn drain battery lot cook brakes 10 10 recommend,NA,-0.9746621251106262,NEGATIVE
2021-08-25,https://www.reddit.com/r/TeslaModel3/comments/pbjrwy/disagreeing_with_electrician/,28,Plug in Hybrid Electric Vehicle,disagreeing electrician,time ago electrician install 14 50 outlet garage 2018 model 3 charging fine months ve learned electrical diy projects found installed 14 50r 30a breaker 10 gauge plug tesla routinely draws 32 32a max spec 40a 50a breaker wiring match 14 50 receptacle breaker tripped time ve lived approached electrician assured spec safe disagree don wrong manually cap charging car 25a safe paid,-0.9897183179855347,NEGATIVE
2023-02-01,https://www.reddit.com/r/TeslaModel3/comments/10r66oo/help/,28,"sustainability,sustainable",NA,tesla model 3 standard range 2 weeks deciding charger charger satisfy sustain battery healthy time drive 820 km week 509 miles week advice suggestions,-0.9634241461753845,NEGATIVE
2021-09-04,https://www.reddit.com/r/TeslaModel3/comments/phj7n9/new_us_lfp_battery_for_sr_window_sticker/,28,battery,lfp battery sr window sticker,NA,-0.987276017665863,NEGATIVE
2019-06-07,https://www.reddit.com/r/TeslaModel3/comments/bxxzes/tesla_enhanced_summons_in_action_my_aja/,28,autonomous,tesla enhanced summons action aja autonomously picking,NA,0.9185692071914673,POSITIVE
2023-04-13,https://www.reddit.com/r/TeslaModel3/comments/12l61px/2018_retrofit_done_all_thanks_to_a_few_videos_and/,29,Battery Electric Vehicle,2018 retrofit videos ebay,NA,-0.9881085753440857,NEGATIVE
2020-05-30,https://www.reddit.com/r/TeslaModel3/comments/gtjf1h/autopilot_issues_on_13hour_road_trip_anyone_else/,29,environment,autopilot issues 13 hour road trip similar experiences,drove la park city yesterday 13 hours leisurely stops charge walk autopilot dream hours trip supercharge baker ca charge engaged ap freeway car software read environment swerve reason driver visualization jump accurately depicting scene understanding cars lanes video illustrate happened simply accurately car front car disappear altogether veer lane reality car front remained steady distance lane cars due strong sunlight shining directly front facing cameras bit research online read experience chocked fast forward hours couple chargers issue continues persist due dirt dust blocking cameras sensors car wipe charging station freeway driver visualization inaccurate direct correlation bother engaging ap risk trip thunderstorm rolled wiped car clean dead bugs dust dirt eye driver visualization accurate chance drivers road arrived safely night drove car bit town morning freeway test question similar experience literature online issue tesla engage ap cameras sensors bugging hard understand beta software advanced cars tesla disappear moment drive pleasure fantastic ap majority 13 hours advise share similar experiences greatly appreciated,-0.9962499737739563,NEGATIVE
2022-09-03,https://www.reddit.com/r/TeslaModel3/comments/x53vtw/custom_plates_finally_arrived_lowbattery/,29,battery,custom plates finally arrived lowbattery,NA,-0.9920756816864014,NEGATIVE
2023-08-01,https://www.reddit.com/r/TeslaModel3/comments/15fmhmf/tesla_performance_3_2023_745hp_as_per_papers/,29,fuel,tesla performance 3 2023 745hp papers,NA,0.7635467052459717,POSITIVE
2023-01-30,https://www.reddit.com/r/TeslaModel3/comments/10ou8mf/why_is_leasing_a_tesla_model_3_a_bad_idea/,29,Hybrid Electric Vehicle,leasing tesla model 3 bad idea,"days ago tesla advertising model 3 lease 399 month 36 months 10,000 miles downpayment 4,500 toyota camry hybrid xle honda accord hybrid lower msrp tesla model 3 sr msrp 45,630 luxury brands charge leases gt 700 month chose toyota camry hybrid xle msrp 34,340 honda accord hybrid msrp 34,635 reference cost lease cars 36 months downpayment 4,500 10,000 miles amp x200b camry lease https preview.redd.it rnqfdosqc4fa1 jpg width 1306 amp format pjpg amp auto webp amp 787da0c940303d514f24a31120820b93bc4c5767 amp x200b accord lease https preview.redd.it mqo4z5bsc4fa1 jpg width 1375 amp format pjpg amp auto webp amp 0f47ed68506ab13e1dc6d09728df5d1afa89a052 amp x200b tesla lease https preview.redd.it l1ffieg5d4fa1 jpg width 864 amp format pjpg amp auto webp amp 1816207f6e38813ce0e887a222f4c58ad4ea8615 tesla's site bad purchase leases https www.tesla.com support leasing lease options gt quoted tesla's website tesla vehicles delivered april 15 2022 eligible purchase party dealerships party individuals eligible purchase leased vehicles model 3 model leases eligible purchase delivery date people teslalounge told bad idea lease tesla model 3 curious bad idea lease tesla model 3",-0.9990419745445251,NEGATIVE
2022-06-22,https://www.reddit.com/r/TeslaModel3/comments/vhxey3/camp_mode_in_hot_summer_got_her_a_bit_wet_15/,30,battery, camp mode hot summer bit wet 15 overnight battery drain btw,NA,-0.9983522891998291,NEGATIVE
2024-10-12,https://www.reddit.com/r/TeslaModel3/comments/1g25e30/and_just_one_more_thing/,30,gas,NA,traded everyday 17 exl civic hatch model3 qs range rwd otd 1.99 27k pleased tesla replacing civic planing experience sf oc road trip dog norcal home kwh rates slightly chargers cheaper gas accessories tesla home charger convenience mat set roof shades counsel trays 70 30 tint windshield shade dog bench seat cover 54 alcohol window cleaner ring key ring wear 30 day trial accessories software hardware wise,-0.9731532335281372,NEGATIVE
2024-06-05,https://www.reddit.com/r/TeslaModel3/comments/1d8v1fk/is_it_a_good_idea_to_rent_a_tesla_model_3_if_i/,30,fuel,idea rent tesla model 3 don home charger car related deliveries,love rent tesla gonna bay month planning renting car drive 10 15 miles day max job stuff idea miles week close 1hr tesla model 3 cheapest rental options including gas vehicles regular camry mazda tesla save money fueling hassle home charger relying public charging deal breaker supercharging station nearby office figured gym charge car set week foods kill time theoretically charge errand supercharging cost understand answers lol,-0.9950031638145447,NEGATIVE
2020-11-10,https://www.reddit.com/r/TeslaModel3/comments/jren17/just_bought_my_first_electric_vehicle_ever_now_im/,30,Hybrid Electric Vehicle,bought electric vehicle nervous,pulled trigger electric vehicle tesla model 3 range nervous decision time veterans reassure choice experience delivery day car hope don run major issues cost arm leg,-0.9743812680244446,NEGATIVE
2020-10-18,https://www.reddit.com/r/TeslaModel3/comments/jdj8rg/went_from_a_yukon_denali_to_the_model_3_and_not/,30,gas,yukon denali model 3 spending 100 gas week makes happy,NA,0.9995043277740479,POSITIVE
