date_utc,url,comments,matched_keyword,cleaned_title,cleaned_text,overall_sentiment_score_post,overall_sentiment_post
2021-11-29,https://www.reddit.com/r/electricvehicles/comments/r4xwil/us_will_miss_electricvehicle_targets_without_big/,55,"Battery Electric Vehicle,Plug in Hybrid Electric Vehicle,Hybrid Electric Vehicle",u.s miss electric vehicle targets investments semiconductor manufacturing commerce secretary warns,NA,-0.9911077618598938,NEGATIVE
2023-06-26,https://www.reddit.com/r/electricvehicles/comments/14jdzuu/aston_martin_is_partnering_with_lucid_for_ev/,56,battery,aston martin partnering lucid ev supercar batteries tech,NA,0.987486720085144,POSITIVE
2019-10-08,https://www.reddit.com/r/electricvehicles/comments/df04qv/i_had_to_string_an_extension_cord_100_around_the/,56,fuel,string extension cord 100 building st day 100 fuel free commute ev,wife live southern mildly unfriendly evs terms infrastructure adoption boss super supportive request charge offered install charging station future,-0.9899157285690308,NEGATIVE
2022-05-09,https://www.reddit.com/r/electricvehicles/comments/ulrq70/level_2_home_charger_hard_wire_or_240_plug_in/,56,environment,level 2 home charger hard wire 240 plug,kia ev6 home charger decide inherent benefit hardwiring level 2 charger plugging 240 fine possibly safety benefit plugs connections fewer failure amp x200b benefit choose hard wire ability hardware move invaluable judgmental understand process amp x200b repeat ill delete mods internet crazy slow wont search amp x200b edit quick responses price plug unit hard wire labor favoring hard wire amp x200b edit 2 update responses discussion didnt realize stumbled controversial ha charger week electrician coming cornered ev charger market town ive trust strongly suggest hardwiring situation based built house ive hold details similar hardwiring pros cons pros outweigh cons belief hardwiring safer environment live ev charger added amenity resale house ill cost admits plug adds convenience charger fail doesnt benefit outweighs risk slight reduction safety plug,-0.9934367537498474,NEGATIVE
2021-02-04,https://www.reddit.com/r/electricvehicles/comments/lc4918/tennessee_funds_statewide_electric_vehicle_fast/,56,"Battery Electric Vehicle,Hybrid Electric Vehicle",tennessee funds statewide electric vehicle fast charging network,NA,0.9435663819313049,POSITIVE
2023-02-21,https://www.reddit.com/r/electricvehicles/comments/118d6a1/the_big_reuse_25_mwh_of_excar_batteries_go_on_the/,56,battery,reuse 25 mwh car batteries grid california,NA,-0.9904994368553162,NEGATIVE
2020-09-15,https://www.reddit.com/r/electricvehicles/comments/it7kly/volkswagen_ag_bev_roadmap/,56,BEV,volkswagen ag bev roadmap,NA,-0.9546893239021301,NEGATIVE
2019-11-16,https://www.reddit.com/r/electricvehicles/comments/dx0usw/california_bans_government_purchases_of_most/,57,gas,california bans government purchases gas powered cars newsom climate,NA,-0.9773340821266174,NEGATIVE
2019-07-14,https://www.reddit.com/r/electricvehicles/comments/cd15u7/collection_of_articles_debunking_the_evs_are/,57,environment,collection articles debunking evs dirtier gas guzzlers canard,frustrating argument fellow met recently repeated usual bjorn lomborg talking gospel idea information faulty suggesting disagreed education insufficient info biased sources fellow agw denier wrote article https medium.com predict electric cars cleaner 99c184cd5dfa topic legwork gathering relevant figures credible sources articles sources dismiss hand environment themed treehugger electrek industry financial sources jalopnik forbes basically collection information print hand source identify environmentalism leftwing politics concise approachable breakdowns propaganda heard fraudulent someplace,-0.9989452958106995,NEGATIVE
2020-04-17,https://www.reddit.com/r/electricvehicles/comments/g3c8r1/goodbye_gas/,57,gas,goodbye gas,NA,-0.9978861212730408,NEGATIVE
2021-02-24,https://www.reddit.com/r/electricvehicles/comments/lr83vp/mercedes_cclass_phev_should_have_100km_pure/,57,PHEV,mercedes class phev 100km pure electric range,NA,0.9874885678291321,POSITIVE
2023-03-31,https://www.reddit.com/r/electricvehicles/comments/127s5dg/legacy_auto_faces_disaster_in_china_with/,58,pollution,legacy auto disaster china unsellable cars pollution crunch looms,NA,-0.998313307762146,NEGATIVE
2021-08-30,https://www.reddit.com/r/electricvehicles/comments/pe7wim/my_2_electric_vehicles_a_1979_um_electrek_panel/,58,"Battery Electric Vehicle,Hybrid Electric Vehicle",2 electric vehicles 1979 um electrek panel van 1980 um electrek 2 2,NA,-0.8123546242713928,NEGATIVE
2019-07-04,https://www.reddit.com/r/electricvehicles/comments/c94ddu/on_this_patriotic_day_buy_ev_for_national_security/,58,BEV,patriotic day buy ev national security,https insideevs.com news 358167 buy ev 4th july anti oil national security https insideevs.com news 358167 buy ev 4th july anti oil national security historically ev buyers focussed environmental benefits main reason buying ev strongly doomsday reports masses simply track motivation admittedly tree hugger ev owner community call climate denier practically minded buyer focussed economic benefits environmental motivation reducing oil consumption reasons article suggests bev helps environmental conditions positive effect 6 ago purchased hybrid convinced reduced oil consumption benefit financially reduce contribution global terrorism reduced gas consumption sufficient pay hybrid's 5k premium similar gas models 2 3 enjoyed car 5 handed son stepped bolt ev reaping economic benefits eliminating oil consumption budget recently invested time tco benefit analysis conclusion sticker price bolt save 10k 5 ownership compared hybrid previously drove purchased replace payback magnified 30k miles due primarily commute 7500 miles yield 3500 lower tco 5 ev adoption gain momentum masses economic geo political benefits evs criticism primarily motivated environmental concerns observation majority potential ev buyers simply prefer convenience cost practicality purchasing decisions enthusiasts share economic geo political reasons public faster movement gain momentum starting environmental benefits surely dissuade listening benefits discussion mentioning secondary benefit appeal wider audience solid estimates tco benefits adds degree credibility arguments knowing grid consumption increasingly renewable sourced gallons gas consume helps energy independent compelling article tool add list resources evangelizing evs,-0.9833893179893494,NEGATIVE
2019-10-16,https://www.reddit.com/r/electricvehicles/comments/diuaw8/the_most_frugal_electric_cars_travel_three_times/,58,fuel,frugal electric cars travel times petrol diesel amount money study claims taking fueling costs account monthly costs internal combustion engine cars electric vehicles closer gap list price suggest,NA,-0.9876949787139893,NEGATIVE
2021-09-14,https://www.reddit.com/r/electricvehicles/comments/pntrwq/us_senate_vs_house_versions_of_the_ev_credit/,58,PHEV,senate house versions ev credit proposal,"post proposed ev credits house senate information gleaned posts senate version simply 12,500 union built 10,000 union 7500 foreign built 2500 evs maximum 80,000msrp 30 msrp base 150 lightning pro eligible 12,000 12,500 41,667 house version complicated mess evs 4,000 base 3,500 battery 40 kwh 2027 bumps 50 kwh minimum requirement 4,500 domestically built union labor 500 produced 50 domestic content 100 battery cells manufactured qualify eligibility subtract 200 1,000 gross income maximum eligibility threshold 800k joint filers 600k head household 400k 55,000 max msrp sedans 64k vans 69k suvs 74k pickup trucks 7 kwh minimum requirement 2023 bumped 10 kwh 150 lightning 74,000 eligible 12,500 tesla eligible 8000 sedans 55k suvs model 69k evs 1,250 base 208.50 kwh capacity exceed 30 sale price maximum eligible sale price 25,000 means maximum credit amount 7,500 income targeted previously mentioned maximum thresholds 150k joint 112,500 head household 75k taxpayers phevs 4,000 base 3,500 battery 40 kwh 2027 bumps 50 kwh minimum requirement 4,500 domestically built union labor 500 produced 50 domestic content 100 battery cells manufactured qualify 55,000 max msrp sedans 64k vans 69k suvs 74k pickup trucks 7 kwh minimum requirement 2023 bumped 10 kwh pertinent phevs house version refundable credit purchase senate version house version removes caps evs 200,000 senate version removes caps increases 400,000 house version effective 2022 2031 passes",-0.9981732368469238,NEGATIVE
2021-09-05,https://www.reddit.com/r/electricvehicles/comments/pikrcj/vw_id_buzz_preview_the_ev_multivan_microbus_is/,58,autonomous,vw id buzz preview ev multivan microbus finally coming drive autonomous,NA,-0.9820349216461182,NEGATIVE
2024-03-26,https://www.reddit.com/r/electricvehicles/comments/1bo2bsm/australia_waters_down_fuel_emissions_standards_in/,59,fuel,australia waters fuel emissions standards blow tesla,NA,-0.9952899217605591,NEGATIVE
2024-05-01,https://www.reddit.com/r/electricvehicles/comments/1chlo3f/chinas_electric_cars_keep_improving_a_worry_for/,59,autonomous,china electric cars improving worry rivals capable autonomous driving chinese automakers threatening pull ahead e.v.s bigger roomier,NA,-0.7481208443641663,NEGATIVE
2021-07-08,https://www.reddit.com/r/electricvehicles/comments/ofxce3/electric_vehicle_chargers_will_soon_go_up_on/,59,"Battery Electric Vehicle,Plug in Hybrid Electric Vehicle,Hybrid Electric Vehicle",electric vehicle chargers street light poles kansas city,NA,0.7776064276695251,POSITIVE
2019-12-15,https://www.reddit.com/r/electricvehicles/comments/eayr4g/google_maps_can_now_search_for_electric_vehicle/,59,"Plug in Hybrid Electric Vehicle,Hybrid Electric Vehicle",google maps search electric vehicle charging stations plug type,NA,-0.984880805015564,NEGATIVE
2023-04-26,https://www.reddit.com/r/electricvehicles/comments/12zm37g/hondas_electric_gokart_shows_off_its_easily/,59,"Battery Electric Vehicle,battery",honda electric kart easily swappable battery system honda replace gasoline engines electric motors batteries,NA,-0.983253538608551,NEGATIVE
2022-08-09,https://www.reddit.com/r/electricvehicles/comments/wjr4t3/is_anybody_else_doing_the_math_and_figuring_out/,59,HEV,math figuring phev isn worth rebate,comparing tucson phev tucson hev ll spare details assuming 0.12 kwh electricity 4.00 gallon gas break extra cost phev edit ve waiting list phev tucson kills hev ago ll join waiting list,-0.9981605410575867,NEGATIVE
2024-10-04,https://www.reddit.com/r/electricvehicles/comments/1fvsfui/number_of_publicly_available_electric_vehicle/,59,"Battery Electric Vehicle,Hybrid Electric Vehicle",publicly electric vehicle chargers doubled start biden harris administration,NA,-0.901549220085144,NEGATIVE
2023-07-06,https://www.reddit.com/r/electricvehicles/comments/14sbvhu/us_truck_makers_reach_deal_to_phase_out_polluting/,59,pollution,u.s truck makers reach deal phase polluting diesel rigs pact california speed transition electric power commercial trucks 2030s reduce particulates pollution,NA,-0.9898262023925781,NEGATIVE
2020-07-28,https://www.reddit.com/r/electricvehicles/comments/hzk7qr/dutch_electricity_price_on_last_sunday_afternoon/,60,fuel,dutch electricity price sunday afternoon charge sunday afternoon energy waste windturbines price solar producers avoid fossil fuel charging,NA,-0.9831536412239075,NEGATIVE
2024-09-23,https://www.reddit.com/r/electricvehicles/comments/1fneajj/electric_car_model_breaks_31000_australian_price/,60,Plug in Hybrid Electric Vehicle,"electric car model breaks 31,000 australian price barrier ev sale electric vehicles",NA,-0.7481208443641663,NEGATIVE
2023-10-10,https://www.reddit.com/r/electricvehicles/comments/174o6mn/mercedesbenz_trucks_celebrates_world_premiere_of/,60,battery,mercedes benz trucks celebrates world premiere battery electric haul truck eactros 600,NA,0.9990697503089905,POSITIVE
2021-06-12,https://www.reddit.com/r/electricvehicles/comments/ny02kb/vw_halts_bev_deliveries_to_their_internal_fleet/,60,BEV,vw halts bev deliveries internal fleet customer demand managers qualify company car choose ice hybrids,NA,-0.9994620680809021,NEGATIVE
2024-08-28,https://www.reddit.com/r/electricvehicles/comments/1f329wg/went_to_a_toyota_dealer_in_tokyo_to_test_drive_a/,60,PHEV,toyota dealer tokyo test drive prius phev test car battery charge,specifically requesting plug variant regular hybrid spend time engine noisy charge mode gain power test pure ev driving mode lasted short time due lack charge additionally dealer employee didn chademo told model improved charging reality removed fast charging port previous gen model frustrated rant,-0.9984991550445557,NEGATIVE
2021-09-07,https://www.reddit.com/r/electricvehicles/comments/pjpg6e/ysk_the_antiev_push_is_just_beginning/,60,fuel,ysk anti ev push beginning,analogous story global warming issue agreed 30ish ago suddenly light switch controversial spiraled control terms narrative powers muddied water people hands air quit time recover progress coming evs misinformation campaigns ramping prior tip iceberg green synthetic fuels instance usual ev's cleaner ice propaganda batteries litter earth,-0.9969058632850647,NEGATIVE
2021-03-04,https://www.reddit.com/r/electricvehicles/comments/lx8001/a_california_city_just_banned_all_new_gas/,61,gas,california city banned gas stations emissions push,NA,-0.9745388031005859,NEGATIVE
2022-10-06,https://www.reddit.com/r/electricvehicles/comments/xwv5yj/anyone_else_get_the_1000_questions_of_things_that/,61,environment,1000 questions wrong bev,wife bev lot car doomsday questions bevs figure funny replies questions run battery ran gas 25 battery damaged accident gas tank hit extra crispy battery chemicals bad environment extracting oil batteries recycled boat 5.7l buy bev save enviroment kicks foreign oil gas price volitility battery replacement costs phone's battery terms quality conditions battery tech prices drop ice emissions tests fail timing belt replacements suck ice 1000 wrong oil add cat steal,-0.9992449283599854,NEGATIVE
2019-04-12,https://www.reddit.com/r/electricvehicles/comments/bcgq34/bc_introduces_law_to_require_cars_trucks_sold_by/,61,gas,b.c introduces law require cars trucks sold 2040 emission legislation aims phase gas powered vehicles,NA,-0.8887718915939331,NEGATIVE
2023-07-21,https://www.reddit.com/r/electricvehicles/comments/155lfqb/dead_ev_batteries_turn_to_gold_with_us_incentives/,61,battery,dead ev batteries gold u.s incentives,NA,-0.9364376068115234,NEGATIVE
2024-01-05,https://www.reddit.com/r/electricvehicles/comments/18z4a6e/ev_breakdowns_due_to_low_battery_drop_to_lowest/,61,battery,ev breakdowns due low battery drop lowest levels record aa,NA,-0.9962215423583984,NEGATIVE
2020-12-29,https://www.reddit.com/r/electricvehicles/comments/kmhbuj/global_evphev_sales_grew_38_in_a_pandemic_year/,61,PHEV,global ev phev sales grew 38 pandemic including 119 europe,NA,0.9961931705474854,POSITIVE
2019-07-09,https://www.reddit.com/r/electricvehicles/comments/cb4u6r/idling_an_internal_combustion_engine_ice_negative/,61,fuel,idling internal combustion engine ice negative miles gallon mpg vehicle idling traffic parked estimated 3.4 vehicle fuel consumption 6 billion gallons fuel annually electric vehicles idle 0 gallons fuel,NA,-0.9968311190605164,NEGATIVE
2022-09-24,https://www.reddit.com/r/electricvehicles/comments/xmswyc/in_chiles_desert_lie_vast_reserves_of_lithium_key/,61,"Battery Electric Vehicle,battery",chile's desert lie vast reserves lithium key electric car batteries,NA,-0.950169563293457,NEGATIVE
2019-06-27,https://www.reddit.com/r/electricvehicles/comments/c66oym/just_took_delivery_of_one_of_the_first_2020_volvo/,61,PHEV,delivery 2020 volvo xc90 t8 liking phev nice,NA,-0.7481208443641663,NEGATIVE
2024-08-30,https://www.reddit.com/r/electricvehicles/comments/1f4r2oz/lost_in_translation_is_ev_jargon_driving_buyers/,61,HEV,lost translation ev jargon driving buyers crazy,technical kwh regenerative braking mpge miles gallon equivalent range anxiety charging level1 level2 dc fast ccs nacs tesla supercharger batteries lithium ion lithium iron phosphate nickel metal hydride solid lithium sulfur cobalt free sodium ion qualifications tax credits rebates powertrain hev phev bev mhev shev fcev car buyer,-0.9985914826393127,NEGATIVE
2024-07-07,https://www.reddit.com/r/electricvehicles/comments/1dxu1qf/new_us_fuel_economy_rules_biased_towards_ice/,61,fuel,fuel economy rules biased ice vehicles,upcoming cafe fuel economy rules adjusting values assess ev mileage purpose awarding credits penalties intended realistic estimates fossil fuel compared method https www.energy.gov eere vehicles articles 10 cfr 474 petroleum equivalent fuel economy calculation final rule https www.energy.gov eere vehicles articles 10 cfr 474 petroleum equivalent fuel economy calculation final rule posted link post 2 days ago incorporate generation efficiency electric power plants distribution losses electric grid ice vehicle cafe scores include distribution losses shipping fuel spills leaks fuel distribution vehicles energy pumping fuel evaporation pump result 71 reduction ev fuel economy ratings nthsa distribute cafe credits penalties valued 140 mpg result drastic footprint evs affect ratings listed fueleconomy.gov http fueleconomy.gov nissan leaf rated 141 mpge rules phased 2026 nissan leaf cafe adjusted rating 40 mpge footprint leaf mpg target 76 mpge 2027 means nissan leaf subject penalty 5000 nominal worth cafe credits sale 2027 subcompact evs buy prius ice truck car companies edited messed math public mpge found actual epa data https www.epa.gov compliance fuel economy data data cars testing fuel economy text 20year 2c 20epa 20provides 20fuel 20fuel 20economy related 20programs,-0.9922686219215393,NEGATIVE
2021-10-20,https://www.reddit.com/r/electricvehicles/comments/qbtkds/saw_an_i8_today_are_they_phevs/,61,PHEV,i8 phevs,NA,-0.9685127139091492,NEGATIVE
2023-11-23,https://www.reddit.com/r/electricvehicles/comments/1823tr2/stellantis_recalling_32125_usmarket_jeep_wrangler/,61,PHEV,"stellantis recalling 32,125 market jeep wrangler 4xe phevs due fire risk",NA,-0.9835994243621826,NEGATIVE
2021-10-19,https://www.reddit.com/r/electricvehicles/comments/qbjwvv/study_recycled_lithium_batteries_as_good_as_newly/,61,battery,study recycled lithium batteries newly mined,NA,-0.9913751482963562,NEGATIVE
2021-11-26,https://www.reddit.com/r/electricvehicles/comments/r2kkac/the_secret_pollution_that_all_cars_are_guilty_of/,61,pollution,secret pollution cars guilty,NA,-0.993449866771698,NEGATIVE
2023-03-06,https://www.reddit.com/r/electricvehicles/comments/11jyw0o/volkswagen_brand_increases_bev_sales_target_in/,61,BEV,volkswagen brand increases bev sales target europe previously 70 2030 80 2030,NA,0.990572988986969,POSITIVE
2024-04-24,https://www.reddit.com/r/electricvehicles/comments/1cbyb1v/volkswagen_unveils_id_code_01_suv_with_new/,61,autonomous,volkswagen unveils id code 01 suv chinese dna l4 autonomous driving,NA,-0.9117121696472168,NEGATIVE
2021-09-20,https://www.reddit.com/r/electricvehicles/comments/prnnwr/akio_toyoda_allev_plans_are_a_threat_to_japan/,62,"sustainability,sustainable",akio toyoda ev plans threat japan,"tokyo japan's auto industry warning government's push carbon neutrality cost country millions jobs millions units lost vehicle output doomsday scenario floated month akio toyoda role chairman japan's automaker association attacked potentially overzealous green manufacturing goals unsustainable japanese government's road map aims slash nation's greenhouse gas emissions 2030 net carbon neutrality 2050 tailored reality japan's economic lifeblood rooted manufacturing toyoda president toyota motor corp world's biggest automaker corporate flagship japan knee jerk shift electric vehicles undercut japan's industrial base country wider creative approach carbon reduction japan export reliant country toyoda regular meeting japan automobile manufacturers association carbon neutrality tantamount issue employment japan politicians cars evs manufacturing industry outmoded protect jobs lives japanese people bring future line efforts japan's auto industry produces 10 million vehicles domestically half exported toyoda noted 2030 forecasts project domestic plants 8 million vehicles equipped combustion engines including hybrids plug hybrids legislated existence means hit outspoken japanese automakers toyoda choice send production vehicles overseas markets exported means production 8 million units lost automotive industry risk losing majority 5.5 million jobs toyoda internal combustion engines enemy produce vehicles role industry spokesman toyota president toyoda outspoken solitary voice moderation flexibility pursuit carbon neutrality argues path adapted specific conditions country freedom technologies lead reduction carbon emissions pushback u.s lawmakers aggressive incentives spur americans buy electric vehicles initiative provisions toyota honda hybrid vehicle champions openly opposed toyota maintains hybrid vehicles significant contributions carbon neutrality equipped internal combustion engines hybrids affordable evs penetrate markets charging infrastructure nonexistent technical improvements hybrids continuously cleaner toyota's calculations 18.1 million hybrid vehicles sold cumulatively carbon dioxide reduction impact sold 5.5 million battery electrics level automaker close achieving economic standpoint hybrids bridge technology evs emissions lessen blow jobs engines transmissions internal combustion extra lease life toyota begun developing engines burn compressed hydrogen gasoline greenhouse gas emissions achieving carbon neutrality enemy carbon dioxide internal combustion toyoda reduce carbon dioxide emissions practical sustainable initiatives line situations countries regions evs japan 40 percent cars sold electrified tiny fraction evs june 777,000 electrified vehicles delivered country fewer 8,500 electric 3,200 import brands 97 percent electrified vehicles sold standard mild hybrids including plug ins fuel cell vehicles japan's hybrid king toyota sold 500 evs japan half 497 lexus ux 300e crossovers 74 toyota pod minicars toyoda faulted japanese policymakers copy paste ev centric policies adopted europe automakers slow develop hybrid technology japanese government targets target figures decided line actual situation japan line regulatory trends europe toyoda country approach carbon neutrality based situations",-0.9939549565315247,NEGATIVE
2024-03-21,https://www.reddit.com/r/electricvehicles/comments/1bkl3zw/audi_committed_to_launching_last_gaspowered_car/,62,gas,audi committed launching gas powered car 2026,NA,0.9664741158485413,POSITIVE
2023-04-20,https://www.reddit.com/r/electricvehicles/comments/12splbl/evs_too_heavy_for_parking_garages_im_sure_its_not/,62,environment,evs heavy parking garages suvs,fox demonise environment,-0.9888216257095337,NEGATIVE
2021-06-06,https://www.reddit.com/r/electricvehicles/comments/ntlyhg/exclusive_bidens_electric_vehicle_plan_includes/,62,"Battery Electric Vehicle,Plug in Hybrid Electric Vehicle,Hybrid Electric Vehicle,battery",exclusive biden electric vehicle plan includes battery recycling push lithium opportunity recycling global leader recycling lithium existing batteries driving batteries,NA,-0.9668324589729309,NEGATIVE
2020-06-29,https://www.reddit.com/r/electricvehicles/comments/hi70ip/mcdonalds_announces_plans_to_introduce_rapid/,62,"Battery Electric Vehicle,Hybrid Electric Vehicle",mcdonald's announces plans introduce rapid charging electric vehicles uk drive thrus,NA,0.9478403329849243,POSITIVE
2018-06-18,https://www.reddit.com/r/electricvehicles/comments/8s0k6x/mitsubishi_updates_2019_outlander_phev_with_more/,62,PHEV,mitsubishi updates 2019 outlander phev,NA,0.8594817519187927,POSITIVE
2020-10-05,https://www.reddit.com/r/electricvehicles/comments/j5a86c/spotted_the_past_and_present_of_electric_vehicles/,62,"Battery Electric Vehicle,Hybrid Electric Vehicle",spotted past electric vehicles parked front royal va,NA,-0.8480359315872192,NEGATIVE
2022-08-12,https://www.reddit.com/r/electricvehicles/comments/wm9a2l/study_shows_people_trust_tesla_the_most_for/,62,autonomous,study people trust tesla building autonomous cars,NA,0.9908120036125183,POSITIVE
2021-08-09,https://www.reddit.com/r/electricvehicles/comments/p15dq8/tesla_claims_92_battery_cell_material_recovery_in/,62,battery,tesla claims 92 battery cell material recovery recycling process,NA,-0.9549514651298523,NEGATIVE
2023-03-28,https://www.reddit.com/r/electricvehicles/comments/124d898/us_japan_strike_trade_deal_on_electric_vehicle/,62,"Battery Electric Vehicle,Hybrid Electric Vehicle,battery",japan strike trade deal electric vehicle battery minerals,NA,-0.9785476922988892,NEGATIVE
2023-10-13,https://www.reddit.com/r/electricvehicles/comments/176xzv0/volkswagen_group_delivers_45_percent_more/,62,Plug in Hybrid Electric Vehicle,"volkswagen delivers 45 percent electric vehicles 9 months 531,500",NA,0.9856411814689636,POSITIVE
2024-05-26,https://www.reddit.com/r/electricvehicles/comments/1d0uy9e/2024_byd_shark_is_a_phev_pickup_set_to_take_on/,63,PHEV,2024 byd shark phev pickup set world,NA,0.7481208443641663,POSITIVE
2024-06-04,https://www.reddit.com/r/electricvehicles/comments/1d81d28/byd_sold_146395_bevs_in_may_up_22_yoy_580974_bevs/,63,BEV,"byd sold 146,395 bevs 22 yoy 580,974 bevs",NA,-0.9834717512130737,NEGATIVE
2021-04-27,https://www.reddit.com/r/electricvehicles/comments/mzdk6a/4262021_i_claim_that_our_audi_etron_is_the_first/,64,BEV,4 26 2021 claim audi tron bev coyote buttes south trailhead 36.9566n 111.9800w bit 8.8 ground clearance model tron,NA,-0.9813598394393921,NEGATIVE
