date_utc,url,comments,matched_keyword,cleaned_title,cleaned_text,overall_sentiment_score_post,overall_sentiment_post
2021-07-08,https://www.reddit.com/r/electricvehicles/comments/og8k7s/volkswagen_bmw_fined_1_billion_by_eu_for/,17,pollution,volkswagen bmw fined 1 billion eu pollution cartel,NA,-0.995305061340332,NEGATIVE
2021-02-26,https://www.reddit.com/r/electricvehicles/comments/lt1ipq/vw_commercial_vehicle_moves_ahead_with_autonomous/,17,autonomous,vw commercial vehicle moves ahead autonomous driving amp mobility service consistently rapidly id buzz vehicle vw drive autonomously,NA,0.9807296395301819,POSITIVE
2024-01-09,https://www.reddit.com/r/electricvehicles/comments/192j90a/we_got_our_first_ev_this_saturday/,17,autonomous,ev saturday,soul my2021 replaces 2014 peugeot 308 sw ev 1 modern car led headlights super nice blind spot sensors reversing cross traffic adaptive cruise nice flawlessly combination steering assistant drive autonomously motorway highway head display nice navigation app pre heating doors lock handy seat heating steering wheel heating seat cooling audio enjoyable 2 electric car lots torque time pedal driving fast charging plenty range quiet comfort ice driver love 3 bad trunk miss 2 zone climate control bit electric seats memory shame torque fast michelin tires driving 60 km floor pedal,0.9921833872795105,POSITIVE
2022-04-25,https://www.reddit.com/r/electricvehicles/comments/ubpn95/whats_a_good_reliable_fun_to_drive_hev_but_also/,17,HEV,reliable fun drive hev gas,camry hybrid accord hybrid choice suggestions,0.9997218251228333,POSITIVE
2021-11-22,https://www.reddit.com/r/electricvehicles/comments/qzs8mq/worlds_first_autonomous_electric_container_ship/,17,autonomous,world's autonomous electric container ship completed trip,NA,0.9970646500587463,POSITIVE
2021-01-24,https://www.reddit.com/r/electricvehicles/comments/l3op8t/electric_vehicles_close_to_tipping_point_of_mass/,18,environment,electric vehicles close tipping mass adoption environment,NA,0.9508346915245056,POSITIVE
2022-01-23,https://www.reddit.com/r/electricvehicles/comments/saon85/former_spacex_engineers_bring_autonomous_electric/,18,autonomous,spacex engineers bring autonomous electric rail vehicle startup stealth,NA,0.9949434399604797,POSITIVE
2020-01-31,https://www.reddit.com/r/electricvehicles/comments/ewt1ub/jim_cramer_im_done_with_fossil_fuel_stocks/,18,fuel,jim cramer fossil fuel stocks,NA,-0.9747220277786255,NEGATIVE
2022-04-13,https://www.reddit.com/r/electricvehicles/comments/u2qsxo/meme_refuting/,18,environment,meme refuting,memes lines takes battery picture ice forward environment picture nice clean oil admittedly colleagues relatives share simple easy copy paste explanation wrong overly simplified,-0.994572103023529,NEGATIVE
2022-10-14,https://www.reddit.com/r/electricvehicles/comments/y43wx3/miners_are_cutting_co2_emissions_in_half_by/,18,"Battery Electric Vehicle,Plug in Hybrid Electric Vehicle,Hybrid Electric Vehicle",miners cutting co2 emissions half switching electric vehicles extracting critical minerals,NA,-0.9892394542694092,NEGATIVE
2022-01-14,https://www.reddit.com/r/electricvehicles/comments/s414iy/putting_the_argument_to_bed_evs_are_still_better/,18,environment,putting argument bed evs environment life cycle,NA,0.7481208443641663,POSITIVE
2020-12-01,https://www.reddit.com/r/electricvehicles/comments/k4j64w/the_5000_ev_incentive_for_individuals_in_austria/,18,PHEV,"5,000 ev incentive individuals austria continue 2021 cars base trims cost 60,000 eligible","source german https auto.oe24 news sieht die elektroauto kaufpraemie 2021 aus 455955193 https auto.oe24 news sieht die elektroauto kaufpraemie 2021 aus 455955193 car purchase incentives 2021 government extended funding subsidy purchase electric cars plug hybrids extended purchase vehicles funded 2021 purchase vehicles subsidised 2021 compared year's subsidy prerequisite proof green electricity home company total funding pot 48 million euros 5,000 euros private individuals purchase pure electric car bev continue subsidised 5,000 euros plug hybrid phev 2,500 euros pure electric vehicles 3,000 euros government 2,000 euros importers phevs costs split 50 50 companies public funding reduced pure electric cars bevs subsidised 4,000 euros plug hybrids 2,000 euros companies benefit increased investment bonus prerequisites receiving support plug hybrids purely electric minimum range 50 km phevs petrol engine combustion unit supported aspect private individuals eligible price threshold 60,000 euros previously threshold individuals 50,000 companies threshold 60,000 op clarification means base trim car buy costs 60,000 whichever trim buying elegible subsidy charging stations addition purchase subsidy electric cars subsidy commercial vehicles charging stations motorcycles extended charging stations funded coming purchase electric car private individuals wallbox installed home 600 euros funding effect reported increased funding summer caused boom cars september 9 percent registrations electric vehicles 11,000 applications july total 10,520 pure electric cars registered january october 2020 corresponds share 5.1 percent total registrations 38,000 cars austria's roads share total car population 5.08 million 0.8 percent addition 5,479 plug hybrids registered austria ten months translated google translate deepl",-0.9894499182701111,NEGATIVE
2020-11-05,https://www.reddit.com/r/electricvehicles/comments/johel6/uk_plugin_market_share_at_121_66_bev_55_phev/,18,PHEV,uk plug market share 12.1 6.6 bev 5.5 phev,NA,-0.7481208443641663,NEGATIVE
2017-03-07,https://www.reddit.com/r/electricvehicles/comments/5xx13v/vw_unveils_an_allelectric_and_selfdriving_van_for/,18,autonomous,vw unveils electric driving van future autonomous emission taxi services,NA,-0.9441589713096619,NEGATIVE
2021-04-13,https://www.reddit.com/r/electricvehicles/comments/mq1gnq/vws_truck_subsidiary_why_the_future_belongs_to/,18,"sustainability,sustainable",vw's truck subsidiary future belongs electric truck hydrogen solution sustainable road freight transport pure electric drive cheaper efficient,NA,0.9927172660827637,POSITIVE
2021-03-06,https://www.reddit.com/r/electricvehicles/comments/lyt8ux/you_can_reduce_health_care_if_you_can_reduce/,18,pollution,reduce health care reduce pollution created autos hydrogen ev,NA,-0.9061154723167419,NEGATIVE
2020-12-03,https://www.reddit.com/r/electricvehicles/comments/k5vdjm/28965_bev_sold_in_germany_in_november_10_market/,19,BEV,28.965 bev sold germany november 10 market share 523 compared nov 2019,NA,-0.9477113485336304,NEGATIVE
2022-01-23,https://www.reddit.com/r/electricvehicles/comments/sawqb0/autonomous_batterypowered_rail_cars_could_steal/,19,autonomous,autonomous battery powered rail cars steal shipments truckers,NA,-0.9634121656417847,NEGATIVE
2024-09-01,https://www.reddit.com/r/electricvehicles/comments/1f6gstk/byd_sells_record_373083_cars_in_aug_phevs_hit_6th/,19,PHEV,"byd sells record 373,083 cars aug phevs hit 6th consecutive month record sales",NA,0.9205840826034546,POSITIVE
2019-05-29,https://www.reddit.com/r/electricvehicles/comments/buhuhf/ferrari_introduces_new_production_phev_ferrari/,19,PHEV,ferrari introduces production phev ferrari sf90 stradale,NA,0.998134970664978,POSITIVE
2019-10-22,https://www.reddit.com/r/electricvehicles/comments/dlh9na/how_to_debunk_the_following_naysayers_perspective/,19,pollution,debunk naysayer's perspective,times comment threads forums news articles people post lines hybrid ev vehicle replace current ice gas hog larger impactful ghg emissions reduced personal action stems hybrids evs economical compared gas models cheap gas prices person human accelerated climate change people china india produce pollution ghg industrialized nations argue reduce ghg target top industries guy amp x200b fear time majority guys developed nations time switch hybrids evs late prevent 1 degree warming time average person economically acceptable trust technology,0.9799522757530212,POSITIVE
2018-03-07,https://www.reddit.com/r/electricvehicles/comments/82pjji/its_a_small_step_but_my_company_got_our_first_bev/,19,BEV,step company bev company car,NA,0.9740689992904663,POSITIVE
2020-09-16,https://www.reddit.com/r/electricvehicles/comments/itsiow/living_in_a_flat_apartment_without_a_garage_do/,19,HEV,living flat apartment garage electric vehicle,technology adopt live flat garage charge home wondering people similar position found phev hybrid solution electric silly question edit clarify leaning phev specifically aware acronyms types understand bev phev erev hev discussion,-0.9931886196136475,NEGATIVE
2022-02-20,https://www.reddit.com/r/electricvehicles/comments/swwun0/new_battery_tech/,19,battery,battery tech,NA,0.9001125693321228,POSITIVE
2023-01-27,https://www.reddit.com/r/electricvehicles/comments/10mw7uc/portland_international_auto_show/,19,environment,portland international auto,hey input auto month excited rivian suv tesla privately owned vehicles companies alongside nonprofits teach people electrics trade past brainstorming brainwashed nutjobs confront fight respond thinking talk politics sadly bring environment political radicals,0.9839487671852112,POSITIVE
2024-05-10,https://www.reddit.com/r/electricvehicles/comments/1cox4ne/question_about_ev_batteries_and_raw_materials/,19,environment,question ev batteries raw materials,afternoon assignment school focused evs specifically rivian identify opportunity benefit company meaningful propose rivian invest program clearer average person sold ev idea ev battery manufacturing bad environment jumped researching reddit post ago ev batteries consumables gasoline batteries recyclable brings question true ev batteries wear degrade time recycle battery remanufacture battery element brand usable battery understand consumed lost batteries life time,-0.9965593218803406,NEGATIVE
2019-05-20,https://www.reddit.com/r/electricvehicles/comments/br2shl/study_us_fossil_fuel_subsidies_exceed_pentagon/,19,fuel,study u.s fossil fuel subsidies exceed pentagon spending,NA,-0.7481208443641663,NEGATIVE
2023-12-13,https://www.reddit.com/r/electricvehicles/comments/18hqsdv/us_bev_registrations_exceeded_100000_for_the/,19,BEV,"u.s bev registrations exceeded 100,000 time october 2023",ev sales slow bs fuck murdoch media lies wsj embarrassed decent reputation trashed,-0.9996811151504517,NEGATIVE
2020-05-11,https://www.reddit.com/r/electricvehicles/comments/ghq29n/what_is_a_phev_mhev_bev_and_hev/,19,HEV,phev mhev bev hev,NA,0.9945907592773438,POSITIVE
2019-01-23,https://www.reddit.com/r/electricvehicles/comments/aiytkq/uk_i_want_to_suggest_electric_cars_for_my/,20,environment,uk suggest electric cars company's fleet recommendations,company fleet company cars replaced recommend electrical cars option boss idea fussed research cost comparisons research calculations feedback people missed details buying leasing total distance round trips 100 miles roads tend winding roads total milage 5000 10000 miles car cost shown reduction emissions moment focusing nissan leaf comparison calculations lower lifetime costs assuming amount time imagine leaf downsides current leeway range rough environment expertise leaf zoe kona worth price company advice appreciated,-0.9944025874137878,NEGATIVE
2018-09-11,https://www.reddit.com/r/electricvehicles/comments/9ezb12/a_kochfueled_attack_on_electric_buses_picks_up/,20,fuel,koch fueled attack electric buses picks speed,NA,-0.7481208443641663,NEGATIVE
2020-12-12,https://www.reddit.com/r/electricvehicles/comments/kby567/bev_registrations_in_the_uk_are_up_171_in_q3_2020/,20,BEV,"bev registrations uk 171 q3 2020 compared q3 2019 36,000 newly registered source gov.uk department transport",NA,-0.8513211011886597,NEGATIVE
2016-06-02,https://www.reddit.com/r/electricvehicles/comments/4m8rp6/bmw_retargeting_i_division_to_autonomous_driving/,20,autonomous,bmw retargeting division autonomous driving,NA,-0.9883400201797485,NEGATIVE
2020-03-27,https://www.reddit.com/r/electricvehicles/comments/fq3y8d/data_are_finally_in_electric_cars_really_do/,20,pollution,data finally electric cars produce co2 pollution,NA,-0.9916743636131287,NEGATIVE
2022-03-07,https://www.reddit.com/r/electricvehicles/comments/t8yeq4/epa_to_tighten_tailpipe_rules_for_the_biggest/,20,pollution,e.p.a tighten tailpipe rules biggest polluters road,NA,-0.9827739000320435,NEGATIVE
2024-07-12,https://www.reddit.com/r/electricvehicles/comments/1e1cojh/evs_phevs_could_still_reach_50_us_market_share_by/,20,PHEV,evs phevs reach 50 u.s market share 2030,NA,0.982901930809021,POSITIVE
2023-10-10,https://www.reddit.com/r/electricvehicles/comments/174seko/honda_debuts_its_firstever_electric_autonomous/,20,autonomous,honda debuts electric autonomous riding lawn mower,NA,0.9216005206108093,POSITIVE
2020-07-09,https://www.reddit.com/r/electricvehicles/comments/ho2g5v/musk_doubles_down_on_level_5_autonomy_this_year/,20,autonomous,musk doubles level 5 autonomy,https www.reuters.com article tesla autonomous iduskbn24a0he utm_source reddit.com promised autonomous coast coast ride happened https www.theverge.com 2016 10 19 13341100 tesla driving autonomous road trip la nyc constantly autopilot stops user interactions throws doubt level 5 autonomy ten btw tesla 12.2 miles testing public roads california 2019 rest simulation,-0.9910150170326233,NEGATIVE
2019-07-21,https://www.reddit.com/r/electricvehicles/comments/cg1ik0/rumor_mill_next_gen_cadillac_escalade_will_also/,20,BEV,rumor mill gen cadillac escalade offered bev 400 mile range targeted,NA,-0.9435223340988159,NEGATIVE
2021-08-20,https://www.reddit.com/r/electricvehicles/comments/p82xlg/the_einride_pod_an_autonomous_ev_delivery_truck/,20,autonomous,einride pod autonomous ev delivery truck difficult traffic situations remote operator drive operator monitoring multiple pods solution fill gap autonomy achieved,NA,-0.9685551524162292,NEGATIVE
2021-09-21,https://www.reddit.com/r/electricvehicles/comments/psl5sp/which_evs_manufacturing_process_has_the_lowest/,20,"sustainability,sustainable",ev manufacturing process lowest carbon footprint,wife buying euv factors ve car sustainably considerations include price size accommodate kids teslas sustainably tesla model ve bit pricey differences sustainable manufacturing practices makes models fairly similar,-0.9982988238334656,NEGATIVE
2023-03-05,https://www.reddit.com/r/electricvehicles/comments/11iiqf1/bevs_outsell_hybrids_in_australian_ev_market_in/,21,BEV,bevs outsell hybrids australian ev market february,NA,-0.9648838043212891,NEGATIVE
2019-07-12,https://www.reddit.com/r/electricvehicles/comments/ccc3ur/china_eyes_policy_to_rely_more_on_hybrid_cars_to/,21,pollution,china eyes policy rely hybrid cars clean air pollution,NA,-0.9592953324317932,NEGATIVE
2020-02-02,https://www.reddit.com/r/electricvehicles/comments/exr6b7/france_82_bev_market_share_in_january_2020/,21,BEV,france 8.2 bev market share january 2020,NA,0.9901608228683472,POSITIVE
2020-01-27,https://www.reddit.com/r/electricvehicles/comments/euof44/gm_will_spend_22_billion_to_build_electric_and/,21,autonomous,gm spend 2.2 billion build electric autonomous vehicles detroit plant,NA,-0.9873002171516418,NEGATIVE
2019-11-26,https://www.reddit.com/r/electricvehicles/comments/e1wy94/how_much_smaller_is_the_carbon_footprint_of_an/,21,pollution,carbon footprint average electric car 100 kilometers normal car,electric cars awesome cities move pollution releasing city emissions powerplants statistic carbon emission generating electrcity average electric car 100 kilometers comparison emission regular car,-0.8805885314941406,NEGATIVE
2023-10-20,https://www.reddit.com/r/electricvehicles/comments/17c61nx/norway_september_change_in_fuel_sale_for_road/,21,fuel,norway september change fuel sale road traffic 9.0 talking,NA,-0.7481208443641663,NEGATIVE
2017-07-03,https://www.reddit.com/r/electricvehicles/comments/6kxnq8/open_letter_to_dunkin_doughnuts_they_provide_ev/,21,pollution,letter dunkin doughnuts provide ev charging stores pittsburgh,proud owner chevy bolt care trip dunkin donuts chargers price charging makes stupid decision marketing call rob looked equivalent gas decided 0.20 price minute 2 gallon gas 30 mpg car rob decides tack 5 top rob equivalent run convenience store person filling tank sends spouse kids bathroom buys stick gum soda guilt facilities rob stupid forgotten run actual food store people charging station captive audience 30 minutes appreciable amount charge car coffee doughnut mug decided sell fit car prevent spills upholstery nice clean fellow ev car owners head foods grocery shopping grab doughnut coffee beer electrons free level 2 charging 25 miles hour opposed 90 miles 30 min free hang mugs clever phrase wrong stoked chargers dds pittsburgh frankly stores plan pretty epic road trips paying extra game town act road trip rhinebeck ny dds chargers dd street beautiful charger empty family 5 deprived doughnuts remember foods free electrons diet buy carrots doughnuts dd carrots free electrons head foods summary reconsider cost scheme ev chargers champion electric vehicles installing stations taking grand steps save world pollution noisy cars pay play fee slap electrons free entrance fee cost buy coffee doughnut sit car play video games buying actual coffee doughnut competing free charge parking space hours time business people usual customers read people lots disposable income charging stations draw audience start selling carrots sincerely dr_nik real redacted reddit,-0.9982159733772278,NEGATIVE
2022-06-01,https://www.reddit.com/r/electricvehicles/comments/v2f31r/serious_question_as_someone_who_only_drives_4000/,21,environment,"question drives 4,000 miles buying ev net positive environment created emissions removing car pool mileage driver buy",reservation cybertruck supply constraints resolved 5 buy current limited supply environment legitimate question,-0.9900020360946655,NEGATIVE
2017-05-11,https://www.reddit.com/r/electricvehicles/comments/6ahom6/worlds_first_allelectric_and_autonomous_container/,21,autonomous,world's electric autonomous container ship horizon,NA,0.9959524869918823,POSITIVE
2021-09-21,https://www.reddit.com/r/electricvehicles/comments/psm0dz/2021_noev_to_bev_hev/,22,HEV,2021 noev bev amp hev,NA,0.7707453370094299,POSITIVE
2021-10-15,https://www.reddit.com/r/electricvehicles/comments/q8ya9b/am_i_stuck/,22,pollution,stuck,advice fellow french redditors kinda feel stuck ev wise browsing subreddit prospects ev world 100 buying ev car company planning build free recharge stations workplace motivates france conversion bonus car buy ev polluting car 2018 20yo twingo generation die buy clio 4 time budget 10k car worth 15k time rebate 10k rebate selling current car anymore ev market growing worth fuel car crash ev costing expensive fuel car oil prices rising kinda feel stuck expensive car maintain car technically 3yo feel situation stay 5 10 kindly share hopes ideas stucky situation,-0.9996942281723022,NEGATIVE
2021-05-13,https://www.reddit.com/r/electricvehicles/comments/nbn0ll/benz_says_that_it_will_no_longer_develops_fuel/,22,fuel,benz develops fuel engine cars continues sell eliminated market,NA,-0.986885666847229,NEGATIVE
2021-12-04,https://www.reddit.com/r/electricvehicles/comments/r8o101/bev_market_share_in_germany_in_november_reached/,22,BEV,bev market share germany november reached 20 time,NA,0.8398857712745667,POSITIVE
2021-09-10,https://www.reddit.com/r/electricvehicles/comments/plinpf/bevs_are_now_cheaper_on_average_in_china_than/,22,BEV,bevs cheaper average china ices jato dynamics,NA,-0.987230122089386,NEGATIVE
2023-07-14,https://www.reddit.com/r/electricvehicles/comments/14zd0ef/geely_and_renault_establish_joint_venture_to/,22,HEV,geely renault establish joint venture develop hev phev ice powertrain,NA,0.9887139201164246,POSITIVE
2022-10-05,https://www.reddit.com/r/electricvehicles/comments/xw0v5x/norways_ev_sales_september_891_777_bev_114_phev/,22,PHEV,norway ev sales september 89.1 77.7 bev 11.4 phev biggest surprise toyota proace,NA,0.9943494200706482,POSITIVE
2022-05-17,https://www.reddit.com/r/electricvehicles/comments/urn5n1/plugins_are_more_than_half_of_new_cars_in_sweden/,22,"BEV,PHEV",plugins half cars sweden,half 48 april 2022 25 cars bev 24 phev total cars due supply chain issues kia niro ev popular bev april ytd https alltomelbil.se statistik en fjardedel av alla nya bilar var elbilar april 2022 privatkopen dominerar swedish,-0.9937239289283752,NEGATIVE
2024-04-18,https://www.reddit.com/r/electricvehicles/comments/1c7fqmp/saw_an_id_buzz_today_in_austin_it_was_also/,22,autonomous,id buzz austin autonomous ified,NA,-0.9840530157089233,NEGATIVE
2018-09-24,https://www.reddit.com/r/electricvehicles/comments/9iklft/some_interesting_details_about_volkswagens_id/,22,autonomous,details volkswagen's id range edison article,"pre production id models built wolfsburg tested ehra lessien reason roads meb platform underpin 10 million electric vw's 2020 2026 1.6 million sales average annum spring 2022 zwickau plant manufacturing 1500 cars day half million 2022 27 meb models 4 brands.neo production starts november 19 neo inchers shorter golf wheelbase neo electronic architecture networked'neo augmented reality heads display possibly neo start stage 2 3 autonomous driving autonomous possibly 2024 battery cells samsung lg chem.battery sizes range 50 90 kwh range 330 500 wltp liquid cooled volkswagen excepts move generation li ion batteries 800 km range 2021 vw cell types id model family body versions flat slightly sensitive pouch cells box shaped prismatic cells starts 622 nmc cells 15 kilograms outrageously expensive cobalt https translate.googleusercontent.com translate_c depth 1 amp hl de amp utf8 amp prev _t amp rurl translate.google.com amp sl de amp sp nmt4 amp tl en amp https edison.handelsblatt.com erklaeren akkus ohne kobalt sauber aber noch nicht marktreif 22847846 html amp xid 17259,15700023,15700124,15700149,15700186,15700190,15700201,15700214 amp usg alkjrhieq1sey ojgjnoe6dd5snagimnpg id battery pack installed 2020 commodity friendly 811 cells follow cathodes consist 80 percent nickel 10 percent manganese cobalt vw chemist nina harting volkswagen concerned lg chem's plant breskau poland powered coal mind braunschweig produce half million battery systems production meb electric drivetrain begin vw plant salzgitter started production rotor stator electric drive unsure interpretation base price neo 25000 euros including vat id crozz tiguan 0 100 6 225 kwh spec seater version crozz american market flagship id series 2022 elegant noble stromer id.vizzion meter 200 kw seater plenty luxury top version lithium ion battery 100 kwh electric motors travel 800 kilometers smart device wheels virtual assistant reads lips starts minibus id buzz electric successor legendary vw bulli electric vehicles vw intends factories qingdao foshan tianjin local partner faw china battery production locally volkswagen china scheduled launch 40 locally produced electric cars 2025 1.5 million electric cars expected roll chinese production lines cost chinese joint venture partners faw saic vw putting 15 billion euros development electric cars autonomous driving 2022 wolfsburg dimensions vw launch version called volks wallbox id family charge 125 kw amp x200b https translate.google.com translate sl de amp tl en amp js amp prev _t amp hl de amp utf 8 amp https 3a 2f 2fedison.handelsblatt.com 2ferleben 2fvw startet countdown zur grossen elektro offensive 2f23093964 html amp edit text https translate.google.com translate sl de amp tl en amp js amp prev _t amp hl de amp utf 8 amp https 3a 2f 2fedison.handelsblatt.com 2ferleben 2fvw startet countdown zur grossen elektro offensive 2f23093964 html amp edit text",-0.9937201738357544,NEGATIVE
2021-07-05,https://www.reddit.com/r/electricvehicles/comments/oe5pb4/the_german_plugin_vehicle_market_scored_a_record/,22,PHEV,"german plugin vehicle market scored record 64,734 registrations june 33,420 bevs 312 yoy 12.2 share 31,314 phev 23.6 bev phev share",NA,-0.962449848651886,NEGATIVE
2023-02-03,https://www.reddit.com/r/electricvehicles/comments/10sro0w/usc_study_links_adoption_of_electric_vehicles/,22,pollution,usc study links adoption electric vehicles air pollution improved health,NA,0.9088410139083862,POSITIVE
2021-08-25,https://www.reddit.com/r/electricvehicles/comments/pbg8zt/worlds_first_autonomous_7mwh_electric_cargo_ship/,22,autonomous,world's autonomous 7mwh electric cargo ship voyage crew onboard,NA,0.9899667501449585,POSITIVE
2020-08-15,https://www.reddit.com/r/electricvehicles/comments/i9y7op/21_years_later_toretto_finally_got_himself_a/,23,PHEV,21 toretto finally domestic phev,NA,0.9979143738746643,POSITIVE
2021-12-15,https://www.reddit.com/r/electricvehicles/comments/rgrtu9/advice_req_am_i_getting_the_runaround_bought_a/,23,environment,advice req runaround bought kona ev sept 2021 received car,belong live socal mid sept signed purchase agreement san diego hyundai dealer 2019 kona ev 26k 5k told fix battery recall issue waiting battery hyundai 2 weeks pick car call dealer 2 weeks battery arrived called 2 weeks speaking sales manager battery arrive update talked hyundai battery dec 10th spoilers option refund 5k steal 26k car questions giving run 3 months battery delivered understandably environment calling week check waiting advice greatly appreciated wife sharing 1 car,-0.9562162756919861,NEGATIVE
2019-12-31,https://www.reddit.com/r/electricvehicles/comments/ehyu1p/airline_pollution/,23,pollution,airline pollution,airlines contribute alot world pollution governments tax speed fuel efficiency hybridization air line travelling land break flight parcels flights multiple electric airplanes reduce carbon foot print hypothesized electric planes 1000 km miles,-0.9985343217849731,NEGATIVE
