date_utc,url,comments,matched_keyword,cleaned_title,cleaned_text,overall_sentiment_score_post,overall_sentiment_post
2024-06-29,https://www.reddit.com/r/electricvehicles/comments/1dr46n2/cspan_exchange_on_electric_vehicles/,172,"Battery Electric Vehicle,Hybrid Electric Vehicle",span exchange electric vehicles,NA,0.8029603362083435,POSITIVE
2022-05-26,https://www.reddit.com/r/electricvehicles/comments/uy4rfr/hi_relectricvehicles_we_are_denis_sverdlov/,172,"sustainability,sustainable",electricvehicles denis sverdlov founder ceo arrival uk avinash rugoobur president arrival uk ama,"electricvehicles denis sverdlov founder ceo arrival avinash rugoobur president arrival ago arrival embarked journey change mobility bring clean air cities world radical impact world reinvent product method production innovation key method design production electric vehicles local microfactories change transportation globally enormous job changing century huge progress bus achieved eu certification van expected certified quarter start production expected matter months vision send questions answering 10 12 pm edt proof https imgur.com vrkpzv6 https imgur.com vrkpzv6 edit questions closing ama questions arrival products vision reach arrival.com social channels denis amp avinash arrival arrival founded 2015 mission air clean replacing vehicles affordable electric solutions produced local microfactories 2,000 people driving transition evs globally creating products emission desirable sustainable equitable house technologies enable unique method design production rapidly scalable local microfactories world method facilitates cities governments achieving sustainability goals whilst supercharging communities technology company product company supply chain company automotive company mobility company fintech company service company rolled shared goal true sustainability vertically integrated business model radical impact world arrival nasdaq arvl joint stock company governed luxembourg law",0.9870947003364563,POSITIVE
2022-08-31,https://www.reddit.com/r/electricvehicles/comments/x2dcck/toyota_announces_25_billion_expansion_of_north/,172,"BEV,battery",toyota announces 2.5 billion expansion north carolina plant 350 additional jobs bev battery capacity toyota usa newsroom,NA,0.930540144443512,POSITIVE
2023-01-14,https://www.reddit.com/r/electricvehicles/comments/10baz5d/us_bev_sales_reach_808619_in_2022_up_66_58_total/,172,BEV,"bev sales reach 808,619 2022 66 5.8 total sales",NA,0.9804818034172058,POSITIVE
2023-04-25,https://www.reddit.com/r/electricvehicles/comments/12ymbvv/byd_says_fully_autonomous_cars_are_basically/,173,autonomous,byd autonomous cars basically impossible,NA,-0.9972620010375977,NEGATIVE
2020-05-26,https://www.reddit.com/r/electricvehicles/comments/gqy77s/this_500000_electric_yacht_can_cross_oceans_on/,173,"Battery Electric Vehicle,battery,fuel,pollution","500,000 electric yacht cross oceans battery solar power 10 kw solar system 60 kwh battery owner means limitless cruising fuel costs noise vibration smells polluting emissions disturbance marine life",NA,-0.9887567162513733,NEGATIVE
2023-10-01,https://www.reddit.com/r/electricvehicles/comments/16wrll3/why_do_most_phevs_have_bad_mpg/,173,PHEV,phevs bad mpg,toyota lexus phevs significantly mpg battery runs compared regular gas version players bmw mercedes jeep 4xe mpg barely gas counterparts roughly power worse lugging heavy battery toyota owned rav4 prime audi phev previously noticed toyota engine power charge battery normal driving audi relied strictly regen braking heard luxury guys manufacturers follow toyota mpg,-0.999790370464325,NEGATIVE
2021-09-13,https://www.reddit.com/r/electricvehicles/comments/pncb44/spotted_electric_truck_with_340kwh_battery/,174,"Battery Electric Vehicle,battery",spotted electric truck 340kwh battery,NA,-0.9300025105476379,NEGATIVE
2023-12-23,https://www.reddit.com/r/electricvehicles/comments/18pci52/states_need_to_stop_giving_out_permits_for_gas/,174,gas,stop giving permits gas stations include ev chargers,2024 continues trend lot evs road chargers capacity start requiring gas stations 1 universal ev charger 4 gasoline pumps install easily building permit,-0.9900776147842407,NEGATIVE
2021-02-13,https://www.reddit.com/r/electricvehicles/comments/lj228w/tesla_semi_will_have_a_500kwh_battery_pack/,175,battery,tesla semi 500 kwh battery pack,NA,-0.8751413822174072,NEGATIVE
2022-01-25,https://www.reddit.com/r/electricvehicles/comments/scftzl/this_is_not_your_typical_fuel_station/,175,fuel,typical fuel station,NA,-0.9933330416679382,NEGATIVE
2023-02-04,https://www.reddit.com/r/electricvehicles/comments/10tlkqk/usmade_evs_could_get_massively_cheaper_thanks_to/,175,battery,evs massively cheaper battery provisions law called section 45x funds 10 production credits manufacturing battery cells cut half total cost ev battery cells pack built,NA,-0.9923394918441772,NEGATIVE
2023-09-04,https://www.reddit.com/r/electricvehicles/comments/169mgem/vw_brand_ceo_says_11_new_bev_models_will_be/,175,BEV,vw brand ceo 11 bev models launched 2027 confirms target 80 bev sales europe 2030 100 2033,NA,0.9810802340507507,POSITIVE
2022-07-25,https://www.reddit.com/r/electricvehicles/comments/w7y7c7/why_are_electric_vehicles_more_expensive_for/,175,environment,electric vehicles expensive people income,"ve decided electric car retired social security realized 7500 credit applies pay amount taxes sense supposedly tax pay richer sense credit people financial people money qualify credit hell american market decided price electric vehicles range people add insult top ridiculous means 68,000 advantage credit social security taxed logic money thinking electric vehicle gas prices environment industry leans marketing electric vehilces status symbols buy impress credit apply price car tax owe",-0.9963703155517578,NEGATIVE
2019-06-18,https://www.reddit.com/r/electricvehicles/comments/c25t3c/my_goal_is_to_never_own_a_gas_car_said_simone/,176,gas,goal gas car simone giertz transformed tesla model 3 pickup truck generation drivers drive electric feel pad bit fuck oil companies fuck,NA,-0.9696282744407654,NEGATIVE
2021-02-17,https://www.reddit.com/r/electricvehicles/comments/lm1yhs/range_anxiety_no_longer_much_of_a_problem_for/,176,Plug in Hybrid Electric Vehicle,range anxiety electric car owners people simply ev day day trips charge home overnight figured live issue plug night,NA,-0.9843652248382568,NEGATIVE
2022-12-27,https://www.reddit.com/r/electricvehicles/comments/zwpdh2/the_hidden_costs_of_electric_vehicles/,176,"Battery Electric Vehicle,Hybrid Electric Vehicle,gas",hidden costs electric vehicles,christmas journey set mid morning christmas eve travel 400 km cold grammaw pappaws house loaded gills stuffed 2021 kona hit mountains cold time start range anxiety thankfully halfway crossing border reach designated charge location aulac nb fast charge slow charge operated flo network traditional stopping huge gas station blown diner inside bathrooms head inside clean grab lunch mustang pulls sucks fast charger serve christmas eve diner packed finally table drinks watched status charge phone coffee arrives sip door switching chargers mustang decent reach 80 inside rest meal leaving aulac 85 amp x200b stop lincoln nb flo network charger deal level 3 level 2 family surprised 15 km destination stop level 1 charge 2 days flexibility leave head inside station bathrooms grab snacks play video games car leave 75 amp x200b christmas huzzah car slow charging 100 amp x200b boxing day uh weather shit day road boy glad charged lincoln amusing anecdote scheduled departure warm car noon departure pack car charging cable packed thrown trunk regular storage location filled knitting supplies amp x200b weather warmed time plan hopping salisbury flo charger level 3 level 2 lots tesla chargers meh grab lunch bathrooms snacks cool ranch doritos diet coke terrible coffee head 80 aulac time amp x200b reach aulac plug head inside bathroom break snacks amp x200b goal recharge masstown ns flo network occupied pushed stewiake chargers stewiake bad level 3 chargers credit card bad pricey poorly designed stewiake tims gas station dairy queen kfc taco bell minigolf stop dinner headed home charge tacosmell amp x200b notice mentioned money pains describe stop amp x200b spent 55 charge 5 times 5 visits car spent 225 inside station amp x200b station owners reading car spend money inside station money opposed pumps,-0.9975985884666443,NEGATIVE
2023-06-23,https://www.reddit.com/r/electricvehicles/comments/14hd4lp/reuters_exclusive_washington_state_plans_to/,178,Plug in Hybrid Electric Vehicle,reuters exclusive washington plans mandate tesla's charging plug,washington plans require electric vehicle charging companies include tesla's plug program electrify highways federal dollars official told reuters thursday,-0.9820687174797058,NEGATIVE
2022-03-09,https://www.reddit.com/r/electricvehicles/comments/taikcq/hyundai_dealer_told_me_the_weirdest_boldfaced_lie/,178,Plug in Hybrid Electric Vehicle,hyundai dealer told weirdest bold faced lie ve told age 12,bizarre experience buy ev dropped nearest hyundai dealership ioniq 5 dude tells won fair illegal sell evs tn plug hybrid apparently illegal sir parked tesla local porsche mercedes dealerships sell evs ford dealership selling mach es don assumed stupid lie disproven goddamn window claimed ev infrastructure government website page buy evs map chargers tennessee park street multiple ev charging spots offended baffled grown ass sense grown ass mouth gonna leave review website wind model 3 range happen drives model 3 advice,-0.9985772371292114,NEGATIVE
2024-08-08,https://www.reddit.com/r/electricvehicles/comments/1en823s/the_convenience_of_having_an_ev_during_a_power/,178,battery,convenience ev power outage overstated,live cleveland pair ef1 tornados rumbling tuesday knocking vast amount power grid region max 340k energy's 2 million customers cuyahoga county surrounding power suffered day remembered ev6 reverse charging keeping chest freezer cold sump pump running morning hooked demand water heater hot shower couple days recharge phone portable batteries 10 capacity day power outage saved bacon,-0.9960589408874512,NEGATIVE
2021-04-13,https://www.reddit.com/r/electricvehicles/comments/mq4m52/eu_wants_to_phase_out_phevs_sooner_to_accelerate/,179,PHEV,eu phase phevs sooner accelerate ev transition,NA,0.9110168814659119,POSITIVE
2021-01-09,https://www.reddit.com/r/electricvehicles/comments/ktpzy8/nio_et7_is_official_massage_chairs_1000w_sound/,179,"battery,autonomous","nio et7 official massage chairs 1,000w sound system range 500km 310 miles 70kw battery 1000km 621 miles 150kw battery pack 480kw 650hp dual motor 850 nm autonomous driving system lidar 0.23 drag coefficient",NA,-0.9870702028274536,NEGATIVE
2022-04-28,https://www.reddit.com/r/electricvehicles/comments/ue1k93/california_lawsuit_seeks_to_stop_usps_plan_to_buy/,180,gas,california lawsuit seeks stop usps plan buy gas powered trucks,NA,-0.9971029162406921,NEGATIVE
2023-08-29,https://www.reddit.com/r/electricvehicles/comments/164v0wk/we_need_a_penalty_in_the_us_for_parking_in_an_ev/,180,"Battery Electric Vehicle,Plug in Hybrid Electric Vehicle,Hybrid Electric Vehicle,environment",penalty parking ev charging spot,https www.theguardian.com environment 2023 mar 15 australian drivers facing heavy fines parking electric vehicle charging spots,-0.9873256683349609,NEGATIVE
2023-06-23,https://www.reddit.com/r/electricvehicles/comments/14h1tkq/iowa_evs_now_pay_two_taxes_where_gas_cars_only/,181,gas,iowa evs pay taxes gas cars pay,NA,-0.7849278450012207,NEGATIVE
2023-09-10,https://www.reddit.com/r/electricvehicles/comments/16fdgob/currently_stranded_without_power_in_tuolomne/,182,battery,stranded power tuolomne county,welp tuolomne county camping travel trailer towed audi tron yosemite rv park yesterday afternoon dropped wife trailer headed charge car preparation today's drive west monterey arrived ea station chargers offline ugh backtrack 20 miles backup chargepoint station dead 30 soc decide regroup head campsite stop burning battery arrive campsite 25 remaining figure l1 charge 16 amps 45 leave charger nope power campsite damn county neighboring counties ea chargepoint stations offline pg amp estimates power 1 30am fine 25 hours l1 charging ea station morning wake morning power pg amp reporting 7 00pm power restored stranded battery remaining ea station online drive cell service phone calls online generosity neighbor starlink generator planned ahead plan plan avoid stranded rv traveling setup 2 stranded stuck low soc middle regional power outage suuuuucks edit power restored ea station charging yay,-0.9980266690254211,NEGATIVE
2024-07-31,https://www.reddit.com/r/electricvehicles/comments/1eh0d7y/one_year_later_did_we_save_money_on_fuel_i_mean/,182,fuel,save money fuel breakdown,"warning stats nerds move reddit post update based recommendation users updated math tldr saved 1,103.39 fuel maintenance costs 91.95 month bought 2022 ioniq 5 august 2023 breakdown saved means free electrify america promo month installed chargepoint charger garage 3.74 gallon chicago burbs average fuel cost info based ford fusion amp fuelly tracking database 4.26 gallon 0.1483 kwh comed electricity info includes taxes amp fees taking total kwh dividing total bill vehicle home drive ford fusion hybrid changed severely purchased ev 26mpg 12 ford escape combined city highway estimate 40.5mpg 22 ford fusion hybrid based fuelly tracking fillup 97 ford oil change amp maintenance service 100 license plate ev surcharge 600 home charger purchase amp install include spread divided ev replace hybrid 23 24 ev charge total cost 592.88 457 home charging 65.72 electrify america 70.16 evgo 2,626.71 august 2022 2023 997.98 20 ford fusion miles 10,807 266.84 gal 1,143.73 12 ford escape miles 7,951 305.81 gal 485.00 ford oil change amp maintenance service 5 1523.32 august 2023 2024 636.44 20 ford fusion miles 6,892 170.17 gal 592.88 22 hyundai ioniq5 miles 11,866 100.00 ev license plate surcharge 194.00 ford oil change amp maintenance service 2 total savings 1,103.39 91.95 month apples apples ice ev comparison 11,866 miles 1,312.46 109.37 month 2,005.34 ford escape 458.38 gal amp 3 maintenances 692.88 hyundai ioniq 5 amp plate surcharge original ice vehicle 2012 ford escape hypothetical fuel cost 1,706.86 26mpg combined city highway estimate 456.38 gal hypothetical estimate gallons direct ice ev fuel yearly savings 1,113.98 92.83 month original ice vehicle 2012 ford escape hypothetical maintenance cost 194 97 ford oil amp maintaince ford fusion hybrid miles saved 3,915 august 2023 august 2024 miles 6,892 august 2022 august 2023 miles 10,807 ford fusion hybrid fuel savings 361.55 40.5mpg based fuelly tracking fillup 96.67 gal gallons fuel saved",-0.9980497360229492,NEGATIVE
2022-12-31,https://www.reddit.com/r/electricvehicles/comments/zzvdgn/the_elephant_in_the_room_no_one_can_stop_talking/,182,"sustainability,sustainable",elephant stop talking cobalt mining,conversation article evs days mentions unspeakable evils cobalt mining conservatives pounced excuse kill transition sustainable transportation wind mills apparently killing birds implying similar seriousness reality complex conversation firstly mention cobalt mining omits evs transitioning cobalt free lfp low cobalt 70 reduction nca 90 nmca chemistry cobalt extracted batteries recycled batteries road cobalt mines world countries conditions simple importantly social cost appears read articles half cobalt mined drc mined called artisanal miners oversight regulation safety measures children mining operations accidents frequent unacceptable argue reason people choose risks average citizen drc lives 1.90 day poor unsafe conditions access healthcare average miner company safety measures earns 10 day life changing life saving entire family average artisanal miner people poor conditions cobalt mining changing lives hundreds thousands people drc allowing afford safer living conditions underlying care drc unsafe conditions unsafe living conditions drive people risk amounts money conditions improve unsafe due poor regulation enforcement government solving start grants people negotiations government discussion solutions ethical cost cobalt mention tirade evs hope solution hope conversation productive cobalt sort boogeyman people throw context word ev,-0.9978687763214111,NEGATIVE
2019-10-10,https://www.reddit.com/r/electricvehicles/comments/dg372d/the_oil_industry_is_beginning_to_see_rapid_ev/,183,"Battery Electric Vehicle,Plug in Hybrid Electric Vehicle,Hybrid Electric Vehicle,fuel",oil industry beginning rapid ev adoption existential threat business electric vehicles operating 4 miles kwh 78 cheaper fuel average gasoline powered vehicle u.s idaho national laboratory,NA,0.8672691583633423,POSITIVE
2021-01-31,https://www.reddit.com/r/electricvehicles/comments/l9bzkn/biden_commits_entire_us_government_vehicle_fleet/,184,"Battery Electric Vehicle,Hybrid Electric Vehicle",biden commits entire government vehicle fleet electric,NA,-0.7481208443641663,NEGATIVE
2024-02-25,https://www.reddit.com/r/electricvehicles/comments/1b02bsd/no_electric_vehicle_sales_arent_dropping_heres/,184,"Battery Electric Vehicle,Hybrid Electric Vehicle",electric vehicle sales aren dropping,NA,-0.9994345307350159,NEGATIVE
2024-04-19,https://www.reddit.com/r/electricvehicles/comments/1c83aw8/the_us_now_has_1_fast_ev_charging_station_for/,184,gas,1 fast ev charging station 15 gas stations,NA,-0.7481208443641663,NEGATIVE
2023-09-03,https://www.reddit.com/r/electricvehicles/comments/168znja/can_i_idle_my_car/,185,PHEV,idle car,evs phevs battery left hybrids ac heat entertainment systems extended period time worrying car unable start connect jumper cables charge battery amp x200b,-0.9975671768188477,NEGATIVE
2021-11-23,https://www.reddit.com/r/electricvehicles/comments/r00bs0/dodge_will_phase_out_gaspowered_charger_and/,185,gas,dodge phase gas powered charger challenger 2024 evs,NA,0.8920227885246277,POSITIVE
2022-04-27,https://www.reddit.com/r/electricvehicles/comments/ud29ny/gm_will_start_tying_executive_compensation_to/,186,"Battery Electric Vehicle,Hybrid Electric Vehicle",gm start tying executive compensation electric vehicle targets,NA,-0.986586332321167,NEGATIVE
2020-10-16,https://www.reddit.com/r/electricvehicles/comments/jc0aco/biden_in_town_hall_oct_15_i_want_to_stop/,187,fuel,biden town hall oct 15 stop subsidizing oil anymore,time pull brought playing field edit lot responses fracking initial question fracking worth listen assuming drawing biased conclusions specific clip beginning 2nd hour 2 hour mark link lady fracking question oil https youtu.be 9zzzfrapnvo edit2 lots questions subsidies links https www.eia.gov analysis requests subsidy https www.eesi.org papers view sheet fossil fuel subsidies closer tax breaks societal costs,-0.9976744055747986,NEGATIVE
2022-03-05,https://www.reddit.com/r/electricvehicles/comments/t6zptl/dealership_rant_this_is_why_no_one_buys_evs/,187,gas,dealership rant buys evs,i3 dealership morning waiting line overheard conversation dealership employee customer walked half started clerk coal nuclear green note live ontario burn coal 96 renewable https www.cer rec.gc.ca en data analysis energy markets provincial territorial energy profiles provincial territorial energy profiles ontario.html text 202018 2c 20about 2096 25 20of natural 20gas 2c 20with 20some 20biomass customer charge charge clerk shrugs drive road pull gas brand meant dig tesla mentioned l2 l3 charger dealership charge home 90 time rest stops 401 chargers pulled plug share app local chargers rant lithium mining diesel mining process bmw sells cars customer hesitations evs offer extended test drive tl dr bmw clerk spreading fud evs edit lot dealerships hurting demand months wait maintain demand dealerships live tesla's popular brand dealerships poor choice words title normies buy evs evs niche,-0.998519241809845,NEGATIVE
2021-11-16,https://www.reddit.com/r/electricvehicles/comments/qv8vb6/had_to_fill_up_my_i3_this_morning_i_dont_know/,187,gas,fill i3 morning ice people complaining gas prices bad,NA,-0.9997510313987732,NEGATIVE
2024-08-03,https://www.reddit.com/r/electricvehicles/comments/1ejezlu/rivian_now_selling_evs_with_softwarelocked/,187,battery,rivian selling evs software locked batteries,NA,-0.9931215643882751,NEGATIVE
2023-12-10,https://www.reddit.com/r/electricvehicles/comments/18ff5hk/18_million_barrels_of_oil_a_day_avoided_from/,188,"Battery Electric Vehicle,Hybrid Electric Vehicle",1.8 million barrels oil day avoided electric vehicles cleantechnica,NA,-0.9921614527702332,NEGATIVE
2023-10-05,https://www.reddit.com/r/electricvehicles/comments/170l1of/fyi_about_7500_tax_credit_loophole_for_leases_get/,188,battery,fyi 7500 tax credit loophole leases car,fyi advantage 7500 ev tax credit don tesla ford qualifies loophole leases leased vehicles count commercial fleet vehicles dealership qualify ev afaik income battery manufactured manufacturers rebate lease compete american evs prefer buy dealers buy lease 7500 leased term 7500 effectively applied cost lease affecting residual essentially larger percentage discount 3 ev tech progressed bit trade covered couldn post recently helpful evs unaware loophole pro tip costco costo sizeable rebates depending model check website edit update info clarifications 1 dealers lessors pass rebate passing screw money factor rate markups markdowns understand terms sign leasehackr https leasehackr.com resource learning ins outs lease terms money factor calculator play variables affect payments deals lease brokers forums pre negotiated deals difficult beat truecar https truecar.com resource typical markdowns msrp specific makes models simply search car listings estimated price factors markdowns fair sale price addition rebates giving rebate screw markups lack markdowns edmund lease calculator https www.edmunds.com calculators car lease.html typical money factor residuals model specific lease length yearly mileage ve found reflects real expect screwing 2 lessor pass rebate apply initial sale price capitalized cost reduction apply boost residual lessor buy lease gotta benefit 7500 buy applied residual wait lease benefit ll add 3 income tax liability requirements 0 tax liability 1 million advantage,-0.9953998923301697,NEGATIVE
2020-01-03,https://www.reddit.com/r/electricvehicles/comments/ejdtmt/so_looks_like_electric_cars_are_better_in_an/,188,fuel,electric cars emergency power fuel instance,NA,-0.7481208443641663,NEGATIVE
2019-07-31,https://www.reddit.com/r/electricvehicles/comments/ck1zef/1st_successful_paid_customer_battery_change_from/,189,battery,1st successful paid customer battery change 2012 leaf 24kwh 2018 40kwh battery charge 10 000 cad change 2011 12,NA,0.9544345140457153,POSITIVE
2022-03-14,https://www.reddit.com/r/electricvehicles/comments/te96qu/joe_manchin_says_hes_unsure_about_supporting/,189,"Battery Electric Vehicle,Plug in Hybrid Electric Vehicle,Hybrid Electric Vehicle,battery",joe manchin unsure supporting electric vehicles standing line waiting battery,NA,-0.9938302636146545,NEGATIVE
2022-02-11,https://www.reddit.com/r/electricvehicles/comments/spradj/found_an_ev6_first_edition_for_only_2k_over_msrp/,191,gas,found ev6 edition 2k msrp officially gas,NA,-0.9856625199317932,NEGATIVE
2022-08-26,https://www.reddit.com/r/electricvehicles/comments/wy9zy4/prince_harry_idling_in_a_gas_guzzling_suv/,191,gas,prince harry idling gas guzzling suv,NA,-0.9962360262870789,NEGATIVE
2021-03-22,https://www.reddit.com/r/electricvehicles/comments/manymt/us_senators_press_biden_to_set_end_date_for/,192,gas,u.s senators press biden set date gas powered car sales,NA,0.9850570559501648,POSITIVE
2024-10-12,https://www.reddit.com/r/electricvehicles/comments/1g2coqj/after_helene_and_milton_evs_have_been_way_easier/,193,gas,helene milton evs easier recharge ices refuel,electricity returning faster gas,0.8650696277618408,POSITIVE
2021-11-06,https://www.reddit.com/r/electricvehicles/comments/qnrz99/house_passes_bipartisan_infrastructure_bill_75/,193,"Battery Electric Vehicle,Plug in Hybrid Electric Vehicle,Hybrid Electric Vehicle",house passes bipartisan infrastructure bill 7.5 billion building nationwide network plug electric vehicle chargers,NA,-0.7481208443641663,NEGATIVE
2021-09-12,https://www.reddit.com/r/electricvehicles/comments/pmtw2b/mercedes_to_stop_developing_plugin_hybrid_tech_go/,193,Plug in Hybrid Electric Vehicle,mercedes stop developing plug hybrid tech evs,NA,-0.9993250370025635,NEGATIVE
2022-09-25,https://www.reddit.com/r/electricvehicles/comments/xnndyo/electrify_america_just_made_electricvehicle/,194,"Battery Electric Vehicle,Hybrid Electric Vehicle",electrify america electric vehicle charging lot confusing,NA,-0.9952514171600342,NEGATIVE
2021-05-26,https://www.reddit.com/r/electricvehicles/comments/nlfnvk/ford_boosts_electric_vehicle_spending_to_more/,194,"Battery Electric Vehicle,Hybrid Electric Vehicle",ford boosts electric vehicle spending 30 billion aims 40 volume electric 2030,NA,0.9738109111785889,POSITIVE
2024-08-15,https://www.reddit.com/r/electricvehicles/comments/1esj8uv/subarus_solterra_ev_is_the_most_discounted_car/,195,gas,subaru's solterra ev discounted car electric gas,NA,-0.9780680537223816,NEGATIVE
2024-05-26,https://www.reddit.com/r/electricvehicles/comments/1d0zsfx/electric_vehicles_wont_kill_car_culture_theyll/,196,"Battery Electric Vehicle,Hybrid Electric Vehicle",electric vehicles kill car culture,NA,-0.9986453652381897,NEGATIVE
