date_utc,url,comments,matched_keyword,cleaned_title,cleaned_text,overall_sentiment_score_post,overall_sentiment_post
2013-04-26,https://www.reddit.com/r/electricvehicles/comments/1d5kx3/2013_washington_dc_auto_show_epa_environment/,0,environment,2013 washington dc auto amp epa environment labels,NA,-0.9638518691062927,NEGATIVE
2010-08-05,https://www.reddit.com/r/electricvehicles/comments/cxtbj/air_pollution_agency_to_pay_for_electric_car/,0,pollution,air pollution agency pay electric car charging stations green wombat,NA,-0.9960272312164307,NEGATIVE
2020-06-26,https://www.reddit.com/r/electricvehicles/comments/hganwf/amazon_acquire_autonomous_electric_vehicle/,0,autonomous,amazon acquire autonomous electric vehicle developer zoox,NA,-0.802221417427063,NEGATIVE
2016-09-28,https://www.reddit.com/r/electricvehicles/comments/54v0dz/amsterdam_to_get_worlds_first_fleet_of_autonomous/,0,autonomous,amsterdam world's fleet autonomous boats,NA,0.9955283999443054,POSITIVE
2013-08-28,https://www.reddit.com/r/electricvehicles/comments/1la4pz/arlington_weekly_news_the_sustainable_scoop/,0,"sustainability,sustainable",arlington weekly news sustainable scoop recorded aug 22 2013,NA,0.9072456955909729,POSITIVE
2017-07-11,https://www.reddit.com/r/electricvehicles/comments/6mnfg1/audi_confirms_vw_upsized_autonomous_ev_and_new/,0,autonomous,audi confirms vw sized autonomous ev efforts porsche,NA,0.9891908168792725,POSITIVE
2017-01-17,https://www.reddit.com/r/electricvehicles/comments/5oejga/autonomous_nissan_leaf_testing_in_london_begins/,0,autonomous,autonomous nissan leaf testing london begins february leaf talk,NA,-0.947255551815033,NEGATIVE
2018-01-04,https://www.reddit.com/r/electricvehicles/comments/7o5b0a/autonomous_vehicles_are_coming_but_what_does_that/,0,"environment,autonomous",autonomous vehicles coming environment,NA,0.9877440333366394,POSITIVE
2017-03-24,https://www.reddit.com/r/electricvehicles/comments/617xa7/autonomous_vehicles_reinvented/,0,autonomous,autonomous vehicles reinvented,NA,0.9688042998313904,POSITIVE
2019-11-21,https://www.reddit.com/r/electricvehicles/comments/dzls25/autonomous_vehicles_the_long_bumpy_road_ahead/,0,autonomous,autonomous vehicles bumpy road ahead,NA,0.9726446866989136,POSITIVE
2020-11-19,https://www.reddit.com/r/electricvehicles/comments/jwzmym/bmw_unveils_mini_electric_van_concept_to_explore/,0,autonomous,bmw unveils mini electric van concept explore cars autonomous future electrek,NA,0.9922369122505188,POSITIVE
2019-12-12,https://www.reddit.com/r/electricvehicles/comments/e9nk18/building_strategic_sustainable_ev_charging/,0,"sustainability,sustainable",building strategic sustainable ev charging infrastructure future,NA,0.9993383288383484,POSITIVE
2020-09-23,https://www.reddit.com/r/electricvehicles/comments/iyglk1/california_to_stop_sales_of_new_gaspowered_cars/,0,environment,california stop sales gas powered cars 2035,california stop sales gas powered cars 2035 dino grandoni faiz siddiqui brady dennis https www.washingtonpost.com climate environment 2020 09 23 california electric cars,-0.9857155680656433,NEGATIVE
2015-11-02,https://www.reddit.com/r/electricvehicles/comments/3r8q5i/can_evs_save_china_from_air_pollution/,0,pollution,evs save china air pollution,NA,0.8304117918014526,POSITIVE
2019-07-04,https://www.reddit.com/r/electricvehicles/comments/c97bne/daimler_and_bmw_agree_on_longterm_joint/,0,autonomous,daimler bmw agree term joint development autonomous driving techs,NA,-0.9188362956047058,NEGATIVE
2021-08-07,https://www.reddit.com/r/electricvehicles/comments/ozyl4o/dhl_express_adds_electric_planes_to_its_fleet_for/,0,"sustainability,sustainable",dhl express adds electric planes fleet sustainable aviation future,NA,0.9995287656784058,POSITIVE
2019-10-17,https://www.reddit.com/r/electricvehicles/comments/diyzag/eco_rallye_bilbao_was_weekend_full_of_sustainable/,0,"sustainability,sustainable",eco rallye bilbao weekend sustainable mobility motorsport activities participants public,NA,0.9986435770988464,POSITIVE
2021-11-03,https://www.reddit.com/r/electricvehicles/comments/qlqsfh/electric_motomobility_noise_pollution_extract/,0,pollution,electric moto mobility amp noise pollution õ extract green urbanist podcast,NA,-0.9867473840713501,NEGATIVE
2023-12-01,https://www.reddit.com/r/electricvehicles/comments/1889y7s/ev_electra_buys_nevs_emily_electric_car/,0,"sustainability,sustainable",ev electra buys nevs emily electric car,"source article swedish google translated article canadian ev electra buys nev's emily electric car economy company ev electra buys nev's emily electric car build cars trollhättan bring saab's heritage trollhättan canadian ceo jihad mohammed ev electra trollhätte company nevs national electric vehicle sweden ab concept car emily gt ecarexpo gothenburg weekend invited press conference swedish fair friday heading information breakthrough future car industry trollhättan canadian ev electra buys nev's emily electric car cars roll trollhättan acquisition aware development scale production ev electras founder ceo jihad mohammad ev electra establishes subsidiary sweden ev electras takes business negotiations secure future projects trollhättan july ready jihad mohammed ev electra establishes subsidiary sweden underline commitment develop manufacture projects locally strong supporter house solutions strong balance sheets trollhättan people realize visions acquisition pons emily projects crucial milestone pursuit innovation sustainability happy begin journey jihad mohammed nina selander ceo nevs expressed joy news today's announcement wonderful commitment business trollhättan local presence ensures unique identity projects companies common dreams true defining moment nevs ev electra peter eriksson chairman municipal board trollhättan welcomes announcement municipality support tells tt stenhaga invest bought saab factory november stenhaga invest owner saab factory means partly property 395,800 square meters partly 400,000 square meters land fixtures machinery ceo svante andersson previously companies establish car factory nev's twisty journey nevs national electric vehicle sweden ab bumpy ride bankruptcy estate saab automobile stallbacka trollhättan 2012 february announced electric car developer notified 320 company's 340 employees layoffs sadness inform hibernation ceo nina selander wrote press release time",-0.878569483757019,NEGATIVE
2021-06-24,https://www.reddit.com/r/electricvehicles/comments/o74r3w/ev_network_interoperabilityroaming_agreement/,0,environment,ev network interoperability roaming agreement,article greenlots chargepoint electric vehicle charging companies roaming access networks unclear includes electrify america include evgo article https www.axios.com electric vehicle charging roaming networks 4bb951e7 5ab0 426a bd86 c1cee3b55aac.html utm_source twitter amp utm_medium social amp utm_campaign editorial amp utm_content energy environment ev,-0.9929603934288025,NEGATIVE
2021-01-20,https://www.reddit.com/r/electricvehicles/comments/l1jelg/final_year_university_student_need_some_tips_on/,0,"sustainability,sustainable",final university student tips gathering information analysis,sustainable infrastructure uk ev charging ports uk meet demands road users shortfall councils local development plan idea introduce ev charging ports effort combat climate change ports installed poorer typically people wouldn afford normal car mind ev pointless schemes grants introduced uk government combat plug scheme grants dealerships car manufacturers financial aid knock prices ev insight effects potential increase cars lack charging ports comments issue,-0.9117833971977234,NEGATIVE
2021-08-19,https://www.reddit.com/r/electricvehicles/comments/p7lece/future_of_electric_cycle/,0,"sustainability,sustainable",future electric cycle,estimated cagr electric cycle 2026 rise 12.07 internet thin air arrived figure electric vehicles electric cycle sustainable market future,0.9975112676620483,POSITIVE
2021-12-01,https://www.reddit.com/r/electricvehicles/comments/r6edin/gm_joins_irma_to_certify_sustainability_and_human/,0,"sustainability,sustainable",gm joins irma certify sustainability human rights ev supply chain,NA,0.8106768131256104,POSITIVE
2020-10-21,https://www.reddit.com/r/electricvehicles/comments/jffccx/health_costs_of_air_pollution_in_european_cities/,0,pollution,health costs air pollution european cities linkage transport,NA,-0.9643548130989075,NEGATIVE
2019-04-15,https://www.reddit.com/r/electricvehicles/comments/bdh82d/how_amazon_demand_drives_autonomous_truck_tech/,0,autonomous,amazon demand drives autonomous truck tech,NA,-0.987330436706543,NEGATIVE
2023-11-24,https://www.reddit.com/r/electricvehicles/comments/182tvrr/huawei_luxeed_s7_ev_unveils_fully_unmanned/,0,autonomous,huawei luxeed s7 ev unveils unmanned autonomous parking launched market model,NA,0.7481208443641663,POSITIVE
2021-11-18,https://www.reddit.com/r/electricvehicles/comments/qwq5lf/hubject_launched_open_plugcharge_testing_system/,0,environment,hubject launched plug amp charge testing system,hubject announced launch plug amp charge testing system https www.hubject.com openplugncharge utm_source meltwater amp utm_medium socialorganic amp utm_campaign reddit amp utm_id reddit market participants access neutral testing environment discover features plug amp charge commercial obligation plug amp charge https www.electrive.com tag plug amp charge importance certificates system elaborated detailed report https www.electrive.com 2020 12 15 plugcharge missing link breakthrough short certificates stored vehicle charging station connection hubject root pool charging processes started billed automatically market participants experience precisely authorisation processes tool includes creating contracts certificates iso 15118 contract data accessing hubject root pool requesting contract installations issuing evse leaf certificates explains steffen rhinow head plug amp charge enables cpos mos implement plug amp charge independently hubject's existing plug amp charge based implementation plug amp charge developed industry project jointly charging operators cpo roaming network operators charging network providers emp charging manufacturers car manufacturers system certificate system partners authenticate board build system add certificates matching takes certificate pool created hubject note require connection hubject intercharge roaming platform connection certificate pool pki root hubject https www.electrive.com 2021 11 17 hubject launces plugcharge testing system https www.electrive.com 2021 11 17 hubject launces plugcharge testing system,-0.9931315779685974,NEGATIVE
2016-11-19,https://www.reddit.com/r/electricvehicles/comments/5dqnkq/hyundai_ioniq_electric_autonomous_concept/,0,autonomous,hyundai ioniq electric autonomous concept driving vehicle l.a motor,NA,0.9756929278373718,POSITIVE
2018-08-31,https://www.reddit.com/r/electricvehicles/comments/9bs2lj/if_you_are_ev_enthusiast_driver_or_just/,0,"sustainability,sustainable",ev enthusiast driver electric vehicles sustainable transport highly recommend daily briefing martyn lee professional uk radio host,NA,0.9992307424545288,POSITIVE
2021-06-21,https://www.reddit.com/r/electricvehicles/comments/o4tz5r/im_ilya_team_principal_of_acronis_sit_autonomous/,0,autonomous,ilya team principal acronis sit autonomous racing team current n1 roborace crosspost selfdrivingcars,question electric driving car racing join ama selfdrivingcars https www.reddit.com selfdrivingcars comments o484jg im _ilya _team _principal _of _acronis _sit _autonomous https www.reddit.com selfdrivingcars comments o484jg im_ilya_team_principal_of_acronis_sit_autonomous cheers,-0.9886319041252136,NEGATIVE
2016-01-03,https://www.reddit.com/r/electricvehicles/comments/3zc28o/in_a_bid_to_curb_pollution_maharashtra_to_give/,0,pollution,bid curb pollution maharashtra tax waivers electric vehicles,NA,-0.9413672089576721,NEGATIVE
2022-05-14,https://www.reddit.com/r/electricvehicles/comments/upfkpb/indonesias_push_to_be_an_ev_industry_player_and/,0,environment,indonesia's push ev industry player potential cost environment livelihoods cna,NA,-0.7481208443641663,NEGATIVE
2020-11-12,https://www.reddit.com/r/electricvehicles/comments/jsvfzg/kargo_uks_first_autonomous_delivery_vehicle_uses/,0,autonomous,kar uk's autonomous delivery vehicle ai unique package management system complete contact deliveries cargo medical supplies care homes ev cover 60 miles travel single charge designed academy robotics,NA,-0.8889569640159607,NEGATIVE
2016-07-06,https://www.reddit.com/r/electricvehicles/comments/4rg2oq/mahindra_to_develop_range_of_autonomous_electric/,0,autonomous,mahindra develop range autonomous electric vehicles,NA,0.9954368472099304,POSITIVE
2021-02-24,https://www.reddit.com/r/electricvehicles/comments/lrdn83/marylands_largest_school_district_signs_deal_for/,0,environment,maryland's largest school district signs deal electric buses,montgomery county md public schools lease electric school buses effort eliminate diesel powered student transportation https www.washingtonpost.com climate environment 2021 02 24 climate solutions electric schoolbuses https www.washingtonpost.com climate environment 2021 02 24 climate solutions electric schoolbuses,-0.9836038947105408,NEGATIVE
2018-11-06,https://www.reddit.com/r/electricvehicles/comments/9uji5j/maybe_china_can_win_the_race_to_autonomous/,0,autonomous,china win race autonomous vehicles,NA,0.9995205402374268,POSITIVE
2022-09-07,https://www.reddit.com/r/electricvehicles/comments/x87p94/mercedesbenz_esprinter_pilot_project_launched_to/,0,"sustainability,sustainable",mercedes benz esprinter pilot project launched test sustaineer filter technology,NA,-0.969761848449707,NEGATIVE
2017-05-05,https://www.reddit.com/r/electricvehicles/comments/69bwk4/my_new_ev_green_video_project/,0,environment,ev green video project,green beautiful green project promotes green energy showcasing tesla electric cars beautiful green locations local fashion models benefit environmental protection organization called earthjustice fights environment courtrooms fight current administration's anti green policies https www.youtube.com watch lmbobwqqzis amp list plxabfwovf5ytrhf7thypyozauw6iifq2m amp index 6,0.9931708574295044,POSITIVE
2016-10-11,https://www.reddit.com/r/electricvehicles/comments/56vdvf/new_california_law_allows_test_of_autonomous/,0,autonomous,california law test autonomous shuttle driver,NA,-0.9792072176933289,NEGATIVE
2018-09-13,https://www.reddit.com/r/electricvehicles/comments/9fh7pz/nio_experience_eve_concept_autonomous_car/,0,autonomous,nio experience eve concept autonomous car,NA,0.8893670439720154,POSITIVE
2018-10-04,https://www.reddit.com/r/electricvehicles/comments/9l7ccl/nissan_leaf_dominates_european_ev_industry/,0,"sustainability,sustainable,pollution",nissan leaf dominates european ev industry,"amp x200b europe world largest electric vehicle markets china north america european countries clean energy trailblazers nissan leaf enjoyed immense success market renault nissan mitsubishi alliance benefited europe sustainable reputation 26,000 nissan leafs sold continent surprisingly europe selling electric car alliance europe prominent tesla dominates american market automakers compete chinese ev supremacy nissan leafs means world's popular businesses buy sold units globally date 2010 350,000 purchases corporate buy helped nissan leaf success 8,000 vehicles delivered corporate fleets europe remarkable model entered european market businesses major clean energy revolution governments west struggle implement green policy private sector rolled sleeves europe pivot clean energy europe huge incentive embrace electric vehicles importantly global carbon emissions continue rise pollution concentrated asia european countries affected europe oil imported russia eu wise distance authoritarian nation sourcing oil russia europe purchase lithium south america mineral powers electric vehicle batteries computers electronics europe sustainable reputation",0.9976351261138916,POSITIVE
2021-02-16,https://www.reddit.com/r/electricvehicles/comments/ll6ux6/nissan_teamed_up_with_the_japan_french_film/,0,"sustainability,sustainable",nissan teamed japan french film festival electrify theater experience event leaf owners invited enjoy socially distanced sustainable viewing experience drive theater yokohama free engine noise emissions,NA,-0.9247467517852783,NEGATIVE
2022-02-01,https://www.reddit.com/r/electricvehicles/comments/shsb0v/pinpoint_gps_accuracy_and_autonomous_safety/,0,autonomous,pinpoint gps accuracy autonomous safety systems electric flying race car,NA,0.9086334705352783,POSITIVE
2020-09-29,https://www.reddit.com/r/electricvehicles/comments/j1o4qo/polestars_ceo_on_the_polestar_2_the_precept/,0,"sustainability,sustainable",polestar's ceo polestar 2 precept concept true sustainability auto industry,NA,0.9974964261054993,POSITIVE
2021-03-29,https://www.reddit.com/r/electricvehicles/comments/mfyx4k/recycling_startup_redwood_materials_is_partnering/,0,"sustainability,sustainable",recycling startup redwood materials partnering proterra supply ev battery materials sustainably,NA,0.9956230521202087,POSITIVE
2022-06-01,https://www.reddit.com/r/electricvehicles/comments/v2kqio/renault_group_and_managem_group_sign_an_agreement/,0,"sustainability,sustainable",renault managem sign agreement sustainable supply moroccan cobalt,NA,0.9640681743621826,POSITIVE
2017-04-28,https://www.reddit.com/r/electricvehicles/comments/681yfv/road_traffic_remains_biggest_source_of_noise/,0,pollution,road traffic remains biggest source noise pollution europe,NA,-0.9936360120773315,NEGATIVE
2014-12-02,https://www.reddit.com/r/electricvehicles/comments/2o2ga6/seattle_washington_state_promotes_electric_cars/,0,pollution,seattle washington promotes electric cars tackle pollution,NA,0.9832332730293274,POSITIVE
2018-05-25,https://www.reddit.com/r/electricvehicles/comments/8m06sr/stop_pollution_save_your_money_life_and_spare/,0,pollution,stop pollution save money amp life spare loved,NA,-0.8622018098831177,NEGATIVE
2016-11-10,https://www.reddit.com/r/electricvehicles/comments/5c830r/tesla_and_grohmann_collaborates_to_further/,0,autonomous,tesla grohmann collaborates advance evs german engineering combines autonomous technology,NA,0.9984440207481384,POSITIVE
2019-04-07,https://www.reddit.com/r/electricvehicles/comments/bail8q/the_economist_chinas_plans_for_the_electrified/,0,autonomous,economist china plans electrified autonomous shared future car,NA,0.8029511570930481,POSITIVE
2020-07-02,https://www.reddit.com/r/electricvehicles/comments/hjwl5e/the_electric_future_of_autonomous_vehicles/,0,autonomous,electric future autonomous vehicles,NA,0.9951370358467102,POSITIVE
2019-07-17,https://www.reddit.com/r/electricvehicles/comments/ce8ih0/the_long_bumpy_road_to_autonomous_vehicles/,0,autonomous,bumpy road autonomous vehicles,NA,-0.9713355302810669,NEGATIVE
2021-02-19,https://www.reddit.com/r/electricvehicles/comments/lne15s/the_university_of_birmingham_is_working_with/,0,"sustainability,sustainable",university birmingham bentley motors research project deliver sustainable source rare earth magnets electric hybrid vehicles,NA,0.9962533712387085,POSITIVE
2016-07-04,https://www.reddit.com/r/electricvehicles/comments/4r5fkg/transport_evolved_car_news_fatal_autopilot_crash/,0,autonomous,transport evolved car news fatal autopilot crash vw settlement autonomous ev charging,NA,-0.9986730813980103,NEGATIVE
2023-01-13,https://www.reddit.com/r/electricvehicles/comments/10ay616/twin_cities_ev_carshare_saves_money_and_the/,0,environment,twin cities ev carshare saves money environment,NA,0.9968321919441223,POSITIVE
2016-11-27,https://www.reddit.com/r/electricvehicles/comments/5f5qfe/uk_government_allocates_484_million_for_electric/,0,autonomous,uk government allocates 484 million electric autonomous vehicles,NA,-0.8081823587417603,NEGATIVE
2018-05-16,https://www.reddit.com/r/electricvehicles/comments/8jyg91/uniti_a_swedish_startup_developing_an_electric/,0,environment,uniti swedish startup developing electric city car optimised performance agility urban environments user experience replaces press pull touch swipe unveiling 2017 deliveries 2019,NA,-0.7669141292572021,NEGATIVE
2022-06-19,https://www.reddit.com/r/electricvehicles/comments/vfqrt3/university_racing_eindhoven_presents_its_latest/,0,autonomous,university racing eindhoven car ure 16 capable manual autonomous racing,NA,0.7481208443641663,POSITIVE
2021-01-23,https://www.reddit.com/r/electricvehicles/comments/l3npez/vietnams_vinfast_launches_3_electric_crossovers/,0,autonomous,vietnam vinfast launches 3 electric crossovers autonomous capabilities headed n.a europe,NA,0.9409562349319458,POSITIVE
2019-01-25,https://www.reddit.com/r/electricvehicles/comments/ajnr7o/volvos_autonomous_electric_trucks/,0,autonomous,volvo's autonomous electric trucks,NA,0.8345644474029541,POSITIVE
2018-09-10,https://www.reddit.com/r/electricvehicles/comments/9elo09/volvos_360c_concept_car_is_a_fully_autonomous/,0,autonomous,volvo 360c concept car autonomous bedroom wheels electric,NA,0.9309330582618713,POSITIVE
2021-12-29,https://www.reddit.com/r/electricvehicles/comments/rr4127/waymo_and_zeekr_to_collaborate_on_allelectric/,0,autonomous,waymo zeekr collaborate electric autonomous ride hailing vehicle,NA,0.8818753957748413,POSITIVE
2020-09-12,https://www.reddit.com/r/electricvehicles/comments/ir7s9l/why_meps_must_withdraw_dirty_diesels_license_to/,0,pollution,meps withdraw dirty diesel license pollute,NA,-0.9972885847091675,NEGATIVE
2019-09-13,https://www.reddit.com/r/electricvehicles/comments/d3n7hq/worthwhile_watch_rivian_preorder_audience_rivian/,0,"sustainability,sustainable",worthwhile watch rivian pre audience rivian alex hannold foundation discuss rivian batteries sustainability,NA,0.9991421699523926,POSITIVE
2021-08-31,https://www.reddit.com/r/electricvehicles/comments/pfhdk3/xpeng_says_voyager_x2_has_begun_flying_in_extreme/,0,environment,xpeng voyager x2 begun flying extreme environments altitudes,NA,0.9571933746337891,POSITIVE
2021-11-19,https://www.reddit.com/r/electricvehicles/comments/qxde5l/xpeng_unveils_g9_suv_with_xpilot_40_adas_and/,0,environment,xpeng unveils g9 suv pilot 4.0 adas ability charge 200 km 5 minutes,xpeng unveiled electric suv called g9 plans launch quarter 2022 china xpeng g9 likes tesla model nio es6 li auto li g9 feature xpeng xpilot semi autonomous driving system lidar technology nvidia chips xpeng g9 compatible power superchargers cars charge 200 kilometer driving range 5 minutes g9 feature light detection ranging technology lidar systems send lasers bounce measure distance returning beams processed algorithm create dimensional representation surrounding objects key technology autonomous vehicles understand environment https preview.redd.it 71mxavs52j081 jpg width 3840 amp format pjpg amp auto webp amp a94ff3cc1d8e649c6d3994b656c16333a01dd9a3,-0.8541306257247925,NEGATIVE
2014-12-11,https://www.reddit.com/r/electricvehicles/comments/2ozsvd/zeroemission_cars_both_consumers_and_the/,0,environment,emission cars consumers environment win article carlos ghosn chairman amp ceo renault nissan,NA,0.8977358341217041,POSITIVE
2013-10-09,https://www.reddit.com/r/electricvehicles/comments/1o2muj/3_luxury_vehicles_with_sustainable_wood_bamboo/,1,"sustainability,sustainable",3 luxury vehicles sustainable wood bamboo car interiors,NA,0.9950801134109497,POSITIVE
2017-03-18,https://www.reddit.com/r/electricvehicles/comments/6074tx/an_allelectric_and_autonomous_future/,1,autonomous,electric autonomous future,NA,0.9965758919715881,POSITIVE
2022-01-01,https://www.reddit.com/r/electricvehicles/comments/rt8fpm/as_china_govt_strives_to_become_more/,1,environment,china govt strives environmental friendly xpeng tesla compare,https xpengsep.com xpeng environment friendly tesla https xpengsep.com xpeng environment friendly tesla wanna,0.6752617359161377,POSITIVE
2021-02-22,https://www.reddit.com/r/electricvehicles/comments/lpw4b6/bmw_caught_testing_7series_alongside_i7_sporting/,1,autonomous,bmw caught testing 7 series alongside i7 sporting autonomous drive sensor,NA,0.7481208443641663,POSITIVE
2019-01-25,https://www.reddit.com/r/electricvehicles/comments/aju5u3/boeings_electric_autonomous_passenger_air_vehicle/,1,autonomous,boeing electric autonomous passenger air vehicle flight,NA,0.942469596862793,POSITIVE
2021-05-05,https://www.reddit.com/r/electricvehicles/comments/n5j1bl/california_replace_your_ride_program_asm_pretest/,1,pollution,california replace ride program asm pretest,familiar smog stations run asm pretest 2003 car sending paperwork dmv process submitting paperwork manager move forward ryr replace ride application california based program low income individuals qualify grant 9500 trade fuel inefficient car hybrid ev items printout asm pretest emissions levels called smog stations technicians car 2000 california bar regulations run asm pretest agent emailed documentation technically legal gt smog test aware applicants smog station familiar program don report dmv strictly car polluting applicants station test vehicle provide free testing event vehicle tested due covid regulations hold event wait august hoping green light host event meantime missing docs wait august emailed agent past successful instances applicants orange county south la county waiting response check success advance,-0.9973785877227783,NEGATIVE
2013-10-01,https://www.reddit.com/r/electricvehicles/comments/1nj5jj/californias_sustainable_transport_incentives/,1,"sustainability,sustainable",california's sustainable transport incentives leave stone age,NA,-0.7481208443641663,NEGATIVE
2019-07-19,https://www.reddit.com/r/electricvehicles/comments/cf45oo/carmakers_ev_plans_across_europe_2019_to_2025/,1,environment,carmakers ev plans europe 2019 2025 european federation transport environment,NA,0.992743730545044,POSITIVE
