"","subreddit","title","subscribers","date_utc","cleaned_description"
"1","ChinaEV","ChinaEV",275,2020-03-11,"quality discussion news due diligence chinese electric vehicle industry"
"2","MULN_Automotive","$MULN - Mullen Automotive",1917,2022-03-05,"muln official reddit community muln stock amp mullen automotive company mullen automotive electric vehicle company company engaged providing electric vehicle ev options built united fit perfectly american consumer life"
"3","Fisker","Fisker Inc.",11389,2014-09-10,"fisker american electric vehicle automaker founded henrik fisker wife geeta gupta fisker launched 2016 based southern california fisker successor fisker automotive produced fisker karma"
"4","eVehicles","Electric/Plug-In Vehicles",162,2013-08-11,"electric plug vehicle news pictures videos specs reviews related"
"5","ColoradoEVs","Colorado Electric Vehicles",262,2019-04-03,"colorado unique evs unique driving experience affected temperatures topography driving type city highway colorado lot extremes caveats"
"6","marbel","Marbel - Worlds Lightest Electric Skateboard",140,2015-05-27,"users marbel skateboard share stories tips articles _finally_ arrive"
"7","LiAuto","LiAuto",1045,2020-07-13,"li auto li xiang chinese electric vehicle manufacturer headquartered beijing manufacturing facilities changzhou"
"8","HillcrestPetroleum","HillcrestPetroleum",304,2020-10-08,"discussion hillcrest petroleum electric vehicle partnerships affiliated endorsed company"
"9","EuroEV","EuroEV - The subreddit for the European EV Scene",511,2023-10-06,"euroev subreddit discuss european electric vehicle scene discussion european manufacturers vehicles sold europe"
"10","SPEV","Solar Power Electric Vehicles",506,2010-08-11,""
"11","firstcoastevdrivers","firstcoastevdrivers",39,2021-12-07,"electric vehicle ev drivers live jacksonville fl drivers evs"
"12","EVsport","EVsport: A place to discuss electric vehicle (EV) performance, technology, and competition.",70,2017-05-09,"evsport discuss electric vehicle ev performance technology competition nedra formula eprix sanctioned races esuper cars diy evs"
"13","MysoreEVusers","MysoreEVusers",25,2024-04-12,"subreddit dedicated specially discussions seeking solutions electric vehicle consumers join mysuru owning ev"
"14","EVEU","Electric vehicles in Europe",74,2021-02-20,"subreddit dedicated electric vehicles europe related battery electric vehicles bev hybrids hev plug hybrids phev fuel cell electric vehicles fcev news ev models announcements charging infrastructure expansion owner experience tips"
"15","KlokkProjects","KlokkProjects",18,2022-04-19,"developer drive electric tesla smartwatch app wear os combine nfc bluetooth internet communicate vehicle"
"16","EVAustralia","EVAustralia",256,2022-02-24,"subreddit dedicated ev australia universe discuss share information stories electric vehicle technology ownership government policies"
"17","PEVNovaScotia","PEVNovaScotia",17,2021-11-14,"personal electric vehicles started community pev personal electric vehicle riders wheels welcomed community grows rides steps"
"18","wattageoutdoors","wattageoutdoors",21,2023-12-24,"join community focused electric vehicles accessories camping exploring day escapes electric vehicle battery backups solar power electric blanket learn grow explore expand boundaries electric powered adventures perfect eco conscious enthusiasts eager share learn enjoy electrified outdoors"
"19","ocpp","A discussion place for anything OCPP related.",868,2018-11-16,"discussion ocpp related developer seeking answer question world electric vehicle charging"
"20","evplates","Promoting electric vehicles by using clever messages on personalized license plates.",124,2013-02-28,"auto manufacturers electric vehicles sale public market penetration plugin vehicles 1 vehicles sold pure electric vehicle sales 0.2 people aware electric vehicles adopters driving personalized plates increase consumer awareness"
"21","JolteeOfficial","JolteeOfficial",270,2020-01-09,"joltee insurtech company services promote electric mobility addition insurance joltee makes easier access electric vehicles choose electric vehicle driver rewarded drivers rewarded based behavior driving trip jolts jolts joltee ecosystem pay services related electric mobility"
"22","ampnet","AMPNet - Electricity on the blockchain",74,2018-01-17,"ampnet scalable decentralized protocol tokenizing real world assets check https ampnet.io"
"23","yachtracing","Yacht racing",2074,2011-02-07,""
"24","JetsonOne","JetsonOne",29,2021-10-23,"jetson swedish company mission change travel aim skies safe personal electric aerial vehicle prototype proof concept finished spring 2018 busy consumer friendly version project resulted jetson commercially personal electric aerial vehicle fly jetson founded peter ternström tomasz patan 2017"
"25","liautoinvestors","liautoinvestors",1222,2020-12-10,"li auto main reddit community li auto nyse li innovator china's energy vehicle market company designs develops manufactures sells premium smart electric suvs company focuses family friendly features advanced autonomous driving tech interiors positioning key player china ev market"
"26","ElectraMeccanica","ElectraMeccanica",1076,2020-06-04,"official subreddit electra meccanica solo investors fans electric vehicle lovers community discussion official company news solo rollout investment strategies knowledge sharing intentionally false misleading information regard stock trading shared met permaban exceptions"
"27","MazdaPHEV","MazdaPHEV",108,2024-01-22,"supportive unofficial community dedicated celebrating criticizing mazda skyactiv phev plugin hybrid electric vehicle drivetrain cx 60 cx 70 cx 80 cx 90 vehicles mazda model specific subreddits discuss inline6 3.3 turbo drivetrain models"
"28","NZcarfix","NZcarfix",4335,2024-07-02,"diagnose misbehaving cars answer questions talk vehicle related petrol diesel hybrid electric motorbikes engines generators mowers 2 stroke stupid questions treated rudely report specialists user flair identify identifying quality advice credit logo fungusfromamongus agonarch darkaotearoa"
"29","EVenthusiasts","EVenthusiasts",25,2024-03-04,"location starting electric vehicle enthusiasts plug hybrid ev owners hybrid owners charging bored express initial concerns silly evcharging electricvehicles silly explain written initials"
"30","SIRC","SIRC",1551,2021-02-01,"sirc dedicated discussion solar integrated roofing corp otc:sirc integrated single source solar power roofing systems installation platform company specializing commercial amp residential properties company solutions include sales installation solar energy systems battery backup electric vehicle ev charging stations roofing hvac related electrical contracting https twitter.com sircstock https discord.com invite mediatek"
"31","BYDSeagull","BYD Seagull (BYD Dolphin Mini)",115,2024-01-16,"bydseagull community fans byd seagull electric car launched 2024 byd seagull subcompact hatchback sodium ion batteries cheaper sustainable technology lithium1 join share opinions experiences questions innovative economical vehicle respectful fun"
"32","BYDSealAus","BYDSealAus",643,2024-03-26,"byd seal australia subreddit community owners enthusiasts prospective buyers byd seal electric vehicle australia share experiences questions discuss issues trade tips tricks related byd seal remember respectful follow reddiquette discussions constructive build friendly informative community byd seal fans"
"33","SOLAREV","SOLAREV",0,2021-12-26,"solarev dedicated discussion solar integrated roofing corp otc:sirc integrated single source solar power roofing systems installation platform company specializing commercial amp residential properties company solutions include sales installation solar energy systems battery backup electric vehicle ev charging stations roofing hvac related electrical contracting https twitter.com sircstock https discord.com invite mediatek"
"34","abetterrouteplanner","A Better Routeplanner (ABRP)",837,2022-02-14,"forum abrp user community exchange helpful tips evs ev trip planning forum intended support support abrp apps website submit ticket official support options routeplanner abrp simply learn plan trips electric vehicle ev owner curious"
"35","ThePowerRacingSeries","Subreddit for The Power Racing Series",15,2017-07-03,"start 500 power wheel electric kids ride vehicle batteries motor heck nice tires tie leds hood sprinkle glitter feather class haul races locations detailed track race cars glory trophies"
"36","fabulousvehicles","all vehicles too fabulous to be true ",629,2016-05-03,"unique fabulous vehicles trains cars trucks bicycles bikes busses airplanes"
"37","Mirai","Toyota Hydrogen Electric Fuel Cell Mirai",3628,2015-09-30,"mirai toyota hydrogen electric mirai"
"38","twioat","The Worst Idea of All Time fans",2801,2014-09-22,"discuss weirdest podcasts time tim batt tim_batt guy montgomery guy_mont set months ago watch movie grown ups 2once week talk podcast enjoy descent madness cats sex city movie zach effron vehicle friends til death blart mcelroys"
"39","electricvehicle","electricvehicle",112,2021-12-31,""
"40","electricvehicles","Electric Vehicle News and Discussion",320003,2009-04-20,"future sustainable transportation reddit community ev owners enthusiasts join discuss evolving technology entrants charging infrastructure government policy ins outs ev ownership"
"41","TeslaModel3","Tesla Model 3 Electric Vehicle",199307,2015-01-25,"forum discussion tesla model 3 electric vehicle"
"42","cars","r/Cars - For Car Enthusiasts",6846273,2008-03-20,"cars largest automotive enthusiast community internet reddit's central hub vehicle related discussion industry news reviews projects diy guides advice stories"
"43","electriccars","Forum for the machines we've always loved, but now electric.",16120,2012-01-04,"dedicated forum future cars charged garage existing owners future buyers enthusiasts globe"
"44","ElectricVehicleInfo","ElectricVehicleInfo",108,2022-01-21,"electric vehicle updates electric mobility updates ev news india ev daily dose information"
"45","leaf","Nissan LEAF electric vehicle",21620,2011-04-11,"related nissan leaf ev"
"46","Futurology","Future(s) Studies",20878777,2011-12-12,"subreddit devoted field future studies evidence based speculation development humanity technology civilization fediverse https futurology.today"
"47","energy","/r/Energy: News &amp; Discussion",194967,2008-03-19,""
"48","EVConversion","Electric Vehicle Conversion",11250,2016-04-24,"information discussion electric bicycle motorbike car conversions"
"49","TeslaModelX","Tesla Model X Electric Vehicle",13079,2015-01-25,""
"50","technology","/r/Technology ",17279863,2008-01-25,"subreddit dedicated news discussions creation technology surrounding issues"
"51","RealTesla","Tesla talk outside the Church of Elon",102388,2017-07-04,"home tesla discussion drank elon ade"
"52","EVConversions","Electric Vehicle Conversions",0,2013-07-10,"visit evconversion"
"53","evracing","Electric Vehicle Racing",66,2013-11-05,"ev racing home electric vehicle racing reddit cover formula motoe"
"54","teslamotors","r/TeslaMotors - The original and largest Tesla community!",3190967,2010-09-04,"original largest tesla community reddit unofficial forum owners enthusiasts teslalounge relaxed posting user experiences tesla energy technology company originally california headquartered austin texas mission accelerate world's transition sustainable energy produce vertically integrated electric vehicles batteries solar ai software hardware solutions"
"55","environment","Environment",1553853,2008-01-25,"current news information issues related environment"
"56","ModelX","Tesla Model X",10692,2014-10-26,"model safest quickest capable sport utility vehicle history questions discussions post photos share news"
"57","LeaFszas","Nissan LEAF electric vehicle",1728,2023-01-23,"related nissan leaf ev"
"58","teslainvestorsclub","Tesla Investors Club: $TSLA News &amp; Discussions",85278,2018-08-15,"community redditors invested term success tesla"
"59","politics","Politics",8670818,2007-08-06,"politics news discussion u.s politics"
"60","ElectricVehiclesUK","ElectricVehiclesUK",2414,2020-01-20,"news information electric vehicles specific uk globally"
"61","diyev","Build your own Electric Vehicle",418,2015-12-17,"community people converting building scratch electric vehicles"
"62","Conservative","Conservative",1129865,2008-01-25,"largest conservative subreddit https discord.gg conservative"
"63","worldnews","World News",41538448,2008-01-25,"major news world excluding internal news"
"64","BYD","BYD",9042,2021-07-31,"byd biggest electric vehicle makers world"
"65","EVTV","EVTV - Electric Vehicle Television",26,2014-07-18,"watchers evtv electric vehicle television electric car enthusiasts jack rickard idolizers discuss videos blog posts"
"66","canada","Canada",2980381,2008-01-25,"canada official subreddit engage canada nous parlons en anglais en français respectful posting note users subreddit experience posting limitations active community hesitate message mods experience issues"
"67","australia","Australia",2143730,2008-01-26,"dusty corner internet chew fat australia australians"
"68","ElectricVehicles_UK","ElectricVehicles_UK",116,2022-07-07,"electric vehicles uk discord beta https discord.gg b5jh2q8u"
"69","climate","Information about the world's climate",217288,2008-05-07,"truthful accurate information world's climate related activism politics"
"70","RenewableEnergy","Renewable Energy: safe, clean, sustainable energy for our future",132417,2010-07-23,"share fascinating links renewable energy discuss renewable technologies contribute news renewable energy usage meet renewable energy enthusiasts enjoy functional design including user flair links related subreddits header menu links reddit specific information header menu"
"71","teslacanada","Tesla Canada",2256,2016-04-10,"canadian tesla enthusiasts unite talk teslas white north ad hey fellow canucks tesla owners enthusiasts ad proud owner future owner admirer teslas beautiful landscapes canada referral http referatesla.com"
"72","nissanleaf","Please join the Nissan LEAF community at r/LEAF",5057,2013-04-12,"discuss nissan leaf electric vehicle"
"73","india","India: United We Stand",2441981,2008-01-25,"official subreddit india"
"74","Showerthoughts","Showerthoughts",32854954,2011-10-18,"subreddit sharing miniature epiphanies mundane amazing"
"75","ElectricVehiclesNB","ElectricVehiclesNB",274,2021-08-29,"reddit community ev owners enthusiasts brunswick canada discuss evolving technology entrants charging infrastructure government policy ins outs ev ownership"
"76","nzev","New Zealand Electric Vehicle Owners - Current and Future",7802,2020-02-05,"parties electric vehicles cars bikes scooters gather discuss share communicate discuss ev news tips related driving owning electric vehicle zealand questions vehicle electric"
"77","europe","Europe",7600515,2008-01-25,"europe 50 6 countries 230 languages 746m people 1 subreddit"
"78","climateskeptics","Climate Skeptics: Trying to see through the alarmism",43509,2008-07-16,"questioning climate related environmentalism"
"79","EVcirclejerk","EV circlejerk",57,2015-05-18,"electric vehicle circlejerk"
"80","pluginhybrids","plug-in hybrid electric vehicle news",684,2015-11-19,"news product information plug hybrid electric vehicles"
"81","CanadaPolitics","Canada Politics",228549,2010-09-25,"polite discussions canadian politics"
"82","Wallstreetsilver","Wall Street Silver",266803,2021-01-29,"home silversqueeze love silver troy ounce hands extreme pressure"
"83","ElectricVehiclesIndia","Electric Vehicles India",96,2021-08-31,""
"84","NissanAriya","Nissan Ariya EV",2541,2020-06-22,"fans nissan ariya electric vehicle"
"85","fuckcars","fuck cars",456004,2016-02-25,"discussion harmful effects car dominance communities environment safety public health aspiration sustainable effective alternatives mass transit improved pedestrian cycling infrastructure"
"86","economy","Economy",1027985,2008-03-31,"forum economy business politics stocks bonds product releases ipos advice news investment videos predictions government money politics debate capitalism current trends"
"87","EVStocks","EVStocks",1981,2020-06-24,"discuss electric vehicle stocks tsla nkla shll"
"88","RenaultZoe","Renault Zoe EV",1550,2017-09-02,"subreddit renault zoe electric vehicle"
"89","science","Reddit Science",32946858,2006-10-18,"community share discuss scientific research read advances astronomy biology medicine physics social science submit publications popular science coverage current research"
"90","ontario","/r/Ontario",899747,2009-02-01,"ontario largest online community dedicated lovely people ontario canada strive talk discuss ontario question ontario opinions employment issue landlord tenant question"
"91","CanadianEVstocks","CanadianEVstocks",326,2020-12-04,"discussion canadian electric vehicle companies endorsed affiliated company"
"92","ELR","Cadillac ELR",165,2013-11-20,"cadillac extended range electric vehicle"
"93","canoo","canoo",11971,2019-03-25,"canoo american electric vehicle company driven bold innovations design pioneering technologies highly customizable multi purpose platform mpp canoo vehicles deliver class leading interior space footprint supporting wide range vehicle applications consumers businesses canoo trades ticker goev"
"94","IndiaSpeaks","Reddit India Speaks : Bharatam Vadati",904880,2016-03-13,"namaskaram friendly user focused community redditors india stop destination discuss news entertainment science amp technology sports history amp culture economy geopolitics related india millennia tradition india forum promotes freedom speech plurality dialogue enjoy collaborate discuss churning ocean begin"
"95","Microvast_Stock","Microvast_Stock",31,2020-12-05,"electric vehicle power solution provider"
"96","cvillepevclub","cvillepevclub",37,2020-01-20,"charlottesville va personal electric vehicle club time electric scooters electric skateboards electric unicycles join weekly ride"
"97","Sino","Sino: News, Information, Discussion on all things China and Chinese Related",101770,2015-06-09,"sino subreddit news information discussion china chinese related read rules posting submissions manual approval"
"98","neoliberal","Concepts of a Plan for Neoliberalism",178240,2011-04-14,"trains free trade borders trans rights taco trucks corner read sidebar information"
"99","YEGEV","YEGEV - Edmonton's personal electric vehicle community.",0,2020-06-18,"edmonton electric vehicle ev enthusiasts including electric cars ebikes electric scooters wheels electric skateboards personal electric vehicles discussions meetups industry news"
"100","BoltEV","Bolt EV",34023,2015-01-12,"chevy bolt ev euv opel ampera"
"101","Rivian","Rivian Automotive ",103981,2017-01-10,"rivian largest active fan run auto enthusiast rivian community discuss electric vehicle company rivian automotive products brand stock rivian producing generation r1s 2023 rivian produced 57,232 evs delivered 50,122 2022 rivian produced 24,337 evs delivered 20,332 1,015 2021 rivian produces r1t r1s edv releasing r2 r3 r3x"
"102","wallstreetbets","wallstreetbets",16853281,2012-01-31,"4chan found bloomberg terminal"
"103","news","News",28788179,2008-01-25,"news articles current events united rest world discuss"
"104","SPACs","SPACs",172697,2020-05-20,"special purpose acquisition companies spacs units warrants dd reddit"
"105","FCELandBEV","FCELandBEV",91,2021-03-03,"discussing hydrogen fuel cell battery electric vehicles share insights experiences"
"106","evnebraska","evnebraska",38,2021-06-05,"electric vehicle owners enthusiasts nebraska"
"107","conspiracy","conspiracy",2148997,2008-01-25,"forum free thinking discussing issues captured imagination respect views opinions mind goal create fairer transparent world future"
"108","stocks","Stocks - Investing and trading for all",7882055,2008-06-27,"stocks hesitate ticker market news financial education read sidebar rules post check wiki learn"
"109","e208","e208",139,2021-01-08,"community discussion peugeot 208 electric vehicle"
"110","RivianNews","RivianNews",372,2021-05-06,"riviannews fan run community discuss happenings electric vehicle company rivian automotive forthcoming products rivian planning launch r1t truck r1s suv 2021 rivian building electric delivery vehicle amazon"
"111","Nio","NIO",51788,2017-01-23,"nio china leading luxury ev manufacturer nyse nio"
"112","ApteraMotors","Aptera  The Worlds First Solar EV",6070,2020-08-20,"aptera building future journey powered sun"
"113","ERBLICH_ELECTRIC_CARS","ERBLICH_ELECTRIC_CARS",54,2020-10-07,"electric vehicle conversion car restoration resto mode custom car classic porsches"
"114","HyundaiNexo","Hyundai Nexo Hydrogen Electric Fuel Cell Vehicle",214,2018-03-03,"hyundai nexo generation hydrogen electric fuel cell suv hyundai motors"
"115","Canada_sub","Canada_sub",61620,2022-06-15,"sharing news information relating canada major events bizarre world canadians discuss"
"116","todayilearned","Today I Learned (TIL)",38197343,2008-12-28,"learn day learn submit specific found"
"117","greencars","Green Cars",590,2012-03-28,""
"118","KiwiEV","Kiwi EV Adventures",223,2019-10-03,"subreddit pictures amp videos electric vehicle adventures conversion car run batteries"
"119","UpliftingNews","Uplifting News",20043417,2012-05-16,"read share positive uplifting feel news stories"
"120","business","business",2327357,2007-09-17,"business brings business section tips running business pitfalls avoid business teaches smart moves helps dodge foolish"
"121","mullenusa","mullenusa",1034,2021-11-04,"community mullen automotive emerging electric vehicle ev manufacturer"
"122","evs_ireland","Electric Vehicles Ireland",3396,2018-11-12,"subreddit related electrically powered vehicles ireland"
"123","conservatives","conservatives",108056,2008-06-19,"conservatism conservare preserve political social philosophy promotes maintenance traditional institutions supports minimal gradual change society"
"124","AskReddit","Ask Reddit...",48765861,2008-01-25,"askreddit answer provoking questions"
"125","500e","FIAT 500e",544,2017-09-30,"discuss fiat 500e electric vehicle"
"126","erideslascruces","erideslascruces",39,2021-05-27,"personal electric vehicle riders las cruces nm usa share pictures meet people discuss maintenance issues fun sun"
"127","vancouver","Vancouver, British Columbia, Canada, Earth",544024,2008-03-28,"happening metro vancouver news people events articles discussions ocean meets mountains sea sky"
"128","dataisbeautiful","DataIsBeautiful",21230383,2012-02-14,"dataisbeautiful visualizations effectively convey information aesthetics information visualization pretty pictures sole aim subreddit"
"129","CATL","CATL",189,2020-07-13,"news discussion world largest electric vehicle battery company"
"130","ElectrifiedGarage","Electrified Garage",12,2019-05-29,"electrifiedgarage talk electrified garage https electrifiedgarage.com focusing tesla repair electric vehicle repair"
"131","SelfDrivingCars","Self-Driving Cars  Look, no hands!",87088,2012-06-26,"news discussion autonomous vehicles advanced driving assistance systems adas"
"132","EVBox","EVBox",22,2021-06-29,"evbox leading electric vehicle charging solutions europe evb"
"133","LexusRZ450e","LexusRZ450e",355,2022-04-13,"talk upcoming lexus rz 450e electric vehicle"
"134","AustralianEV","Australian EV",707,2014-08-04,"subreddit news discussion related electric vehicle technology australia"
"135","americanmanganese","American Manganese",692,2017-12-05,"american manganese engaged recycling lithium ion electric vehicle batteries based company's patented process producing electrolytic metals ultra low grade manganese deposits post false misleading information purpose manipulating market security prohibited activity sort securities laws tolerated forum managed fans company"
"136","TeslaRoadster","The Tesla Roadster (2008-12, and 2020-) sports car from Tesla Motors.",73,2017-11-20,"dedicated tesla roadster 2008 sports car tesla motors tesla roadster 2020 sports car tesla"
"137","RamchargerBEV","RamchargerBEV",299,2023-11-08,"excited newly announced 2025 ramcharger battery electric vehicle bev"
"138","Clarity","Honda Clarity Electric Vehicles- 2018/19/20 Kelley Blue Book Best Buy",2858,2009-08-20,"clarity created support discontinued honda clarity posts hondaclarity"
